Unidade Gestora;Modalidade;Licitaįão - Número;Licitaįão - Ano;Tipo de Concorręncia;Objeto;Situaįão;Processo Administrativo - Número;Processo Administrativo - Ano;Abertura das Propostas;TCE - Registro;TCE - Número Processo Termo;Valor - Estimado;Valor - Homologado
MUNICIPIO DE NAVEGANTES;A Definir;132;2024;Normal;CELEBRAĮÃO DE CONTRATO ORIUNDO DA ATA DE REGISTRO DE PREĮO 14/2023 AMFRI, QUE TEM COMO OBJETO AS CONTRATAĮÕES FUTURAS DE SERVIĮOS DE DESOBSTRUĮÃO E LIMPEZA DE BOCAS DE LOBO, TRECHOS E RAMAIS DE TUBOS E GALERIAS DE ÁGUAS PLUVIAIS, LIMPEZA DE ESPAĮOS DE FORMA MECANIZADA COM UTLIZAĮÃO DE CAMINHÃO DE SUCĮÃO E HIDROJATEAMENTO DE GRANDE PORTE, COM O RECOLHIMENTO E DESTINAĮÃO CORRETA DOS RESÍDUOS, SERVIĮOS DE MANUTENĮÃO E CONSERVAĮÃO DE PRAĮAS E RUAS, MANUTENĮÃO DE BOCAS DE LOBO, SERVIĮOS DE LIMPEZA E VARRIĮÃO MANUAL E MECANIZADA;Homologada;132;2024;;;;234448.50;234448.50
MUNICIPIO DE NAVEGANTES;Pregão Eletrônico - Lei 14.133/2021;130;2024;Registro de Preįo - (Nova Lei de Licitaįões);PREGÃO ELETRÔNICO PARA REGISTRO DE PREĮOS VISANDO A CONTRATAĮÃO DE EMPRESA ESPECIALIZADA NA PRESTAĮÃO DE SERVIĮOS DE SEGURANĮA DESARMADA, VIGILANTES E BRIGADISTAS PARA ATENDER AS SECRETARIAS, FUNDOS E FUNDAĮÕES DO MUNICÍPIO DE NAVEGANTES/SC.;Fracassada;130;2024;04/10/2024 14:00;2AF64B764F7E58B3530C93F1CC92C7762DEBEC54;;358100.00;
MUNICIPIO DE NAVEGANTES;Pregão Eletrônico - Lei 14.133/2021;129;2024;Registro de Preįo - (Nova Lei de Licitaįões);PREGÃO ELETRÔNICO PARA REGISTRO DE PREĮO VISANDO A CONTRATAĮÃO DE EMPRESA ESPECIALIZADA  PARA PRESTAĮÃO DE SERVIĮOS COM AQUISIĮÃO, MONTAGEM E INSTALAĮÃO DE MOBILIÁRIOS URBANOS PARA USO EM PARQUES, PRAĮAS E ÁREAS PÚBLICAS PARA ATENDER AS NECESSIDADES DAS SECRETARIAS, FUNDOS E FUNDAĮÕES DO MUNICÍPIO DE NAVEGANTES/SC;Homologada;129;2024;17/10/2024 14:00;71945EF32B24CF8D4B4FFCAB113F8A64BFF94EB0;;756120.85;500435.00
MUNICIPIO DE NAVEGANTES;Pregão Eletrônico - Lei 14.133/2021;128;2024;Registro de Preįo - (Nova Lei de Licitaįões);AQUISIĮÃO DE GĘNEROS ALIMENTÍCIOS ATRAVÉS DE PREGÃO ELETRÔNICO PARA REGISTRO DE PREĮO PARA ATENDER AS DEMANDAS DO MUNICÍPIO DE NAVEGANTES/SC;Homologada;128;2024;24/10/2024 14:00;C1C0A53A729B99214958B29BDC17E2DC2ED353CF;;562627.38;961949.99
MUNICIPIO DE NAVEGANTES;Pregão Eletrônico - Lei 14.133/2021;127;2024;Registro de Preįo - (Nova Lei de Licitaįões);AQUISIĮÃO DE CALHAS, RUFOS E LIMPEZA (COM MATERIAL E INSTALAĮÃO INCLUSA), PARA ATENDER AS DEMANDAS DO MUNICÍPIO DE NAVEGANTES/SC.;Homologada;127;2024;29/10/2024 14:00;9306A864C635869788A18377DACB693CB3FD0C3C;;1126510.00;563000.00
MUNICIPIO DE NAVEGANTES;Dispensa Presencial - Lei 14.133/2021;126;2024;Normal - (Nova Lei de Licitaįões);DISPENSA DE LICITAĮÃO VISANDO A AQUISIĮÃO DE MATERIAIS ELÉTRICOS PARA ATENDER AS NECESSIDADES DO CENTRO DE PROCESSAMENTO DE DADOS - CPD DA PREFEITURA MUNICIPAL DE NAVEGANTES/SC, POR MEIO DA SECRETARIA DE ADMINISTRAĮÃO E LOGÍSTICA;Homologada;126;2024;;;DL126/2024;6751.46;6751.46
MUNICIPIO DE NAVEGANTES;Pregão Eletrônico - Lei 14.133/2021;123;2024;Registro de Preįo - (Nova Lei de Licitaįões);PREGÃO ELETRÔNICO PARA REGISTRO DE PREĮOS VISANDO A AQUISIĮÃO DE MATERIAIS (LAJOTAS, MEIOS-FIOS, PAVERS DE CONCRETO E PISO TÁTIL), PARA UTILIZAĮÃO EM MANUTENĮÕES E PAVIMENTAĮÕES DAS VIAS PÚBLICAS DO MUNICÍPIO, ATRAVÉS DA SECRETARIA MUNICIPAL DE OBRAS DE NAVEGANTES/SC.;Homologada;123;2024;11/10/2024 14:00;07122ABB80E15F7C3844AD414E3048946C4574FD;;2831150.00;2234995.00
MUNICIPIO DE NAVEGANTES;Pregão Eletrônico - Lei 14.133/2021;122;2024;Registro de Preįo - (Nova Lei de Licitaįões);REGISTRO DE PREĮO PARA CONTRATAĮÃO DE EMPRESA ESPECIALIZADA EM PRESTAĮÃO DE SERVIĮOS DE SONDAGEM A PERCUSSÃO TIPO SPT (INCLUSO MOBILIZAĮÃO E DESMOBILIZAĮÃO) E PRESTAĮÃO DE SERVIĮOS DE LEVANTAMENTO TOPOGRÁFICO PLANIMÉTRICO E PLANIALTIMÉTRICO A FIM DE  ATENDER AS NECESSIDADES DAS SECRETARIAS, FUNDOS E FUNDAĮÕES DO MUNICIPIO DE NAVEGANTES/SC;Homologada;122;2024;07/10/2024 14:00;709CEAEE7E8A99E5997879AEA25042EC59BB4AAF;;2158100.00;1930912.92
MUNICIPIO DE NAVEGANTES;Pregão Eletrônico - Lei 14.133/2021;121;2024;Normal - (Nova Lei de Licitaįões);CONTRATAĮÃO DE INSTITUIĮÃO BANCÁRIA PARA PRESTAĮÃO DE SERVIĮOS DE PAGAMENTO DE VENCIMENTOS, SALÁRIOS, PROVENTOS E SIMILARES AOS SERVIDORES ATIVOS, INATIVOS E PENSIONISTAS DA ADMINISTRAĮÃO PÚBLICA MUNICIPAL DE NAVEGANTES/SC.;Homologada;121;2024;16/10/2024 14:00;760579ED69AC68F452CD9CDC0C97B7B64BAD23DB;;6250718.00;7700000.00
MUNICIPIO DE NAVEGANTES;Dispensa Presencial - Lei 14.133/2021;120;2024;Normal - (Nova Lei de Licitaįões);AQUISIĮÃO DE TAPETES TIPO HIDRO ABSORVENTE COM BORDA FLEX, PARA ATENDER AS DEMANDAS DA PREFEITURA MUNICIPAL DE NAVEGANTES/SC, POR MEIO DA SECRETARIA DE ADMINISTRAĮÃO E LOGÍSTICA;Homologada;120;2024;;;DL120/2024;3060.00;3060.00
MUNICIPIO DE NAVEGANTES;Pregão Eletrônico - Lei 14.133/2021;119;2024;Registro de Preįo - (Nova Lei de Licitaįões);PREGÃO ELETRÔNICO PARA REGISTRO DE PREĮOS VISANDO A AQUISIĮÃO DE DIVERSAS PLANTAS ORNAMENTAIS, GRAMAS, FLORES, INSUMOS E PEDRAS, PARA SEREM UTILIZADOS NA REVITALIZAĮÃO DAS CRECHES, ESCOLAS, POSTOS DE SAÚDES, PRAĮAS, RÓTULAS, CANTEIROS E AFINS, ATRAVÉS DA SECRETARIA DE OBRAS DO MUNICÍPIO DE NAVEGANTES/SC.;Homologada;119;2024;10/10/2024 14:00;38FC6E022191FC6D757E0435D61A340589E0789E;;1601233.20;1260642.07
MUNICIPIO DE NAVEGANTES;Inexigibilidade - Lei 14.133/2021;118;2024;Credenciamento/Chamamento - (Nova Lei de Licitaįões);CREDENCIMENTO PARA EXPLORAĮÃO TEMPORÁRIA DE ATIVIDADE DE COMÉRCIO AMBULANTE EM PONTOS FIXOS, ATRAVÉS DE TENDA E FOOD TRUCK/TRAILER, NA FAIXA DE AREIA, E EM BOLSÕES NA ÁREA DE ESTACIONAMENTO DA ORLA DO MUNICÍPIO DE NAVEGANTES, DURANTE A TEMPORADA DE VERÃO 2024/2025.;Homologada;118;2024;;;IL118/2024;1.48;0.47
MUNICIPIO DE NAVEGANTES;Pregão Eletrônico - Lei 14.133/2021;117;2024;Registro de Preįo - (Nova Lei de Licitaįões);PREGÃO ELETRÔNICO PARA REGISTRO DE PREĮO VISANDO A CONTRATAĮÃO DE EMPRESA ESPECIALIZADA PARA A INTERMEDIAĮÃO NA PRESTAĮÃO DE SERVIĮOS DE FORNECIMENTO DE PASSAGENS RODOVIÁRIAS E PASSAGENS AÉREAS, PARA VIAGENS NACIONAIS E INTERNACIONAIS, COM SERVIĮOS        DE RESERVA, EMISSÃO DE BILHETES, MARCAĮÃO, REMARCAĮÃO E DEMAIS ATIVIDADES PERTINENTES, PARA ATENDER ĀS NECESSIDADES DA PREFEITURA MUNICIPAL DE NAVEGANTES/SC. /SC.;Homologada;117;2024;17/10/2024 09:00;0CB91FF46AF4043D0AF168042A4855C0600A7F7C;;940000.00;1399262.00
MUNICIPIO DE NAVEGANTES;Dispensa Presencial - Lei 14.133/2021;113;2024;Normal - (Nova Lei de Licitaįões);CONTRATAĮÃO DA BANDA MUSICAL NOVO EMBALO PARA ATENDER A EVENTOS DANĮANTES (BAILES DA 3š IDADE) EM ATENĮÃO AOS IDOSOS, ATRAVÉS DA SECRETARIA MUNICIPAL DE ASSISTĘNCIA SOCIAL;Homologada;113;2024;;;DL113/2024;4800.00;4800.00
MUNICIPIO DE NAVEGANTES;Inexigibilidade - Lei 14.133/2021;111;2024;Credenciamento/Chamamento - (Nova Lei de Licitaįões);CHAMADA PÚBLICA VISANDO O  CREDENCIAMENTO DE PESSOAS JURÍDICAS INTERESSADAS EM OCUPAR ESTANDES PARA COMERCIALIZAĮÃO DE ALIMENTOS E/OU BEBIDAS, DURANTE O PERÍODO DA 2š COPA NÁUTICA, DE 23 A 25 DE AGOSTO  DE 2024, ATRAVÉS DA SECRETARIA MUNICIPAL DE TURISMO, CULTURA E ESPORTE;Homologada;111;2024;;;IL111/2024;0.01;0.05
MUNICIPIO DE NAVEGANTES;Pregão Eletrônico - Lei 14.133/2021;110;2024;Registro de Preįo - (Nova Lei de Licitaįões);CONTRATAĮÃO DE EMPRESA DESTINADA Ā LOCAĮÃO DE VANS, MICRO-ÔNIBUS E ÔNIBUS PARA ATENDER Ā EVENTUAL DEMANDA DE TRANSPORTE MUNICIPAL, INTERMUNICIPAL E INTERESTADUAL DE PESSOAS;Fracassada;110;2024;08/10/2024 14:00;A689FAF2EF32A8747114C9089A520AC6D695397C;;2651489.90;
MUNICIPIO DE NAVEGANTES;Pregão Eletrônico - Lei 14.133/2021;109;2024;Registro de Preįo - (Nova Lei de Licitaįões);AQUISIĮÃO DE EQUIPAMENTOS DE PROTEĮÃO COLETIVA (EPC), EQUIPAMENTOS DE PROTEĮÃO INDIVIDUAL (EPI) E EQUIPAMENTOS DE SINALIZAĮÃO A SEREM UTILIZADOS PELOS SERVIDORES DA SECRETARIA DE OBRAS E SERVIĮOS DO MUNICÍPIO DE NAVEGANTES/SC.;Homologada;109;2024;09/10/2024 14:00;A97C00958D6B9C93F723A22CC557AEC9A132F571;;441396.91;319098.82
MUNICIPIO DE NAVEGANTES;Inexigibilidade - Lei 8.666/1993;108;2024;Credenciamento/Chamamento;CHAMAMENTO PÚBLICO PARA GERENCIAMENTO, OPERACIONALIZAĮÃO E EXECUĮÃO DO SERVIĮO DE PROTEĮÃO SOCIAL ESPECIAL DE ALTA COMPLEXIDADE PARA ACOLHIMENTO INSTITUCIONAL DE ADOLESCENTES DE 12 A 18 INCOMPLETOS (GĘNEROS MASCULINO E FEMININO) NA MODALIDADE ABRIGO INSTITUCIONAL COM CAPACIDADE PARA 20 ACOLHIMENTOS SIMULTÂNEOS.;Homologada;108;2024;;;IL108/2024;2340000.00;4680000.00
MUNICIPIO DE NAVEGANTES;Pregão Eletrônico - Lei 14.133/2021;107;2024;Registro de Preįo - (Nova Lei de Licitaįões);PREGÃO ELETRÔNICO VISANDO A CONTRATAĮÃO DE EMPRESA ESPECIALIZADA EM PRESTAĮÃO DE SERVIĮOS DE LOCAĮÃO DE ESTRUTURAS COM INSTALAĮÃO, MANUTENĮÃO DIÁRIA E DESMONTAGEM DE DECORAĮÃO, CENOGRAFIA, SONORIZAĮÃO  E ILUMINAĮÃO, INCLUINDO TRANSPORTE  PARA ATENDER AOS EVENTOS NATALINOS NATAL DE ENCANTOS  E   2š ENCONTRO DOS CERVEJEIROS  QUE REALIZAR-SE-Á NOS DIAS 23/11/2024 Ā 03/01/2025  PROMOVIDO PELA SECRETARIA DE TURISMO DO MUNICÍPIO DE NAVEGANTES/SC, CONFORME ESPECIFICAĮÕES, QUANTIDADES, CONDIĮÕES CONSTANTES NO EDITAL E TERMO DE REFERĘNCIA E ANEXOS.;Homologada;107;2024;01/10/2024 14:00;22B782FB77A37675240A0F0EF450DED52CE35936;;2643462.53;2000000.00
MUNICIPIO DE NAVEGANTES;Concorręncia Eletrônica - Lei 14.133/2021;105;2024;Normal - (Nova Lei de Licitaįões);CONCORRĘNCIA PÚBLICA VISANDO A CONTRATAĮÃO DE EMPRESA ESPECIALIZADA PARA A PRESTAĮÃO DE SERVIĮOS DE PAVIMENTAĮÃO COM LAJOTA SEXTAVADA, DRENAGEM PLUVIAL E SINALIZAĮÃO VIÁRIA DA RUA LAURO MULLER, NO BAIRRO GRAVATÁ, CONFORME PROJETOS, MEMORIAL DESCRITIVO, PLANILHA ORĮAMENTÁRIA E CRONOGRAMA FÍSICO-FINANCEIRO, ATRAVÉS DA SECRETARIA DE OBRAS DO MUNICÍPIO DE NAVEGANTES/SC.;Homologada;105;2024;05/09/2024 14:00;E20ED2180253B7E0182C94991D28662B412BFA32;;279869.59;207600.00
MUNICIPIO DE NAVEGANTES;Dispensa Presencial - Lei 14.133/2021;103;2024;Registro de Preįo - (Nova Lei de Licitaįões);CONTRATAĮÃO DE EMPRESA ESPECIALIZADA PARA EXECUĮÃO DE SERVIĮOS DE VÍDEO INSPEĮÃO DE TUBOS, ATRAVÉS DA SECRETARIA MUNICIPAL DE OBRAS E SERVIĮOS DE NAVEGANTES/SC.;Homologada;103;2024;;;DL103/2024;54000.00;54000.00
MUNICIPIO DE NAVEGANTES;Inexigibilidade - Lei 14.133/2021;102;2024;Normal - (Nova Lei de Licitaįões);INEXIGIBILIDADE DE LICITAĮÃO VISANDO A CONTRATAĮÃO DO  SHOW ARTÍSTICO MUSICAL COM A BANDA TIPO EXPORTAĮÃO A SER REALIZADO NO DIA 31/12/2024, COM INÍCIO PREVISTO PARA AS 23H00MIN NO PORTAL DO GRAVATÁ COM DURAĮÃO MÍNIMA DE 03HORA00 MINUTOS, DE ACORDO COM O CALENDÁRIO DE FESTIVIDADES DO MUNICÍPIO EM COMEMORAĮÃO ALUSIVA AS FESTAS DE FINAL DE ANO RÉVEILLON 2024/2025, ATRAVÉS DA SECRETARIA MUNICIPAL DE TURISMO, CULTURA E ESPORTE.;Homologada;102;2024;;;IL102/2024;18000.00;18000.00
MUNICIPIO DE NAVEGANTES;Dispensa Presencial - Lei 14.133/2021;100;2024;Normal - (Nova Lei de Licitaįões);AQUISIĮÃO DE SOFTWARE GRÁFICO PARA ATENDER AS DEMANDAS DA SECRETARIA DE COMUNICAĮÃO SOCIAL;Homologada;100;2024;;;DL100/2024;8013.20;8013.20
MUNICIPIO DE NAVEGANTES;Inexigibilidade - Lei 14.133/2021;99;2024;Credenciamento/Chamamento - (Nova Lei de Licitaįões);CHAMAMENTO PÚBLICO VISANDO O CREDENCIAMENTO DE LEILOEIRO OFICIAL PARA ALIENAĮÃO DE BENS IMÓVEIS DO PATRIMÔNIO PÚBLICO DO MUNICÍPIO DE NAVEGANTES/SC, PARA PREPARAĮÃO, ORGANIZAĮÃO E CONDUĮÃO DE LEILÃO.;Homologada;99;2024;;;IL99/2024;0.01;0.04
MUNICIPIO DE NAVEGANTES;Dispensa Presencial - Lei 14.133/2021;98;2024;Normal - (Nova Lei de Licitaįões);AQUISIĮÃO DE CORTADOR MANUAL DE CONCRETO E ASFALTO E DISCOS DE CORTE  PARA SEREM UTILIZADOS NAS DEMANDAS E MANUTENĮÕES, ATRAVÉS DA SECRETARIA DE OBRAS E SERVIĮOS MUNICIPAIS DE NAVEGANTES/SC.;Homologada;98;2024;;;DL98/2024;20395.94;15378.00
MUNICIPIO DE NAVEGANTES;Inexigibilidade - Lei 14.133/2021;97;2024;Normal - (Nova Lei de Licitaįões);INEXIGIBILIDADE DE LICITAĮÃO VISANDO A CONTRATAĮÃO SHOW ARTÍSTICO MUSICAL COM A BANDA TORRE DE BABEL A SER REALIZADO NO DIA 31/12/2024, COM INÍCIO PREVISTO PARA AS 23H00MIN NA PRAIA CENTRAL E/OU ARENA DE EVENTOS COM DURAĮÃO MÍNIMA DE 03HORA00 MINUTOS, DE ACORDO COM O CALENDÁRIO DE FESTIVIDADES DO MUNICÍPIO EM COMEMORAĮÃO ALUSIVA AS FESTAS DE FINAL DE ANO RÉVEILLON 2024/2025, ATRAVÉS DA SECRETARIA MUNICIPAL DE TURISMO, CULTURA E ESPORTE.;Homologada;97;2024;;;IL97/2024;21500.00;21500.00
MUNICIPIO DE NAVEGANTES;Pregão Eletrônico - Lei 14.133/2021;96;2024;Normal - (Nova Lei de Licitaįões);Aquisiįão de equipamentos para máquinas agrícolas (Concha de Limpeza, Cabine e Aleirador para trator), para atender a demanda de atendimentos aos agricultores de pequeno porte do interior do município, para prestaįão de serviįos  através da Secretaria de Agricultura e Pesca.;Homologada;96;2024;18/09/2024 14:00;5043A1FF20C76A97D8CBC1D745EF976468E920CD;;73581.65;69400.00
MUNICIPIO DE NAVEGANTES;Pregão Eletrônico - Lei 14.133/2021;94;2024;Registro de Preįo - (Nova Lei de Licitaįões);LICITAĮÃO DESTINADA EXCLUSIVAMENTE Ā MEI, MICROEMPRESA E EMPRESA DE PEQUENO PORTE PREGÃO ELETRÔNICO PARA REGISTRO DE PREĮO VISANDO AQUISIĮÃO DE MATERIAIS DE CONSTRUĮÃO PARA UTILIZAĮÃO NAS MANUTENĮÕES PREVENTIVAS E CORRETIVAS DOS PRÉDIOS E EDIFÍCIOS DE USO DO MUNICÍPIO DE NAVEGANTES/SC, BEM COMO REPAROS EM GERAIS, ATRAVÉS DA SECRETARIA MUNICIPAL DE OBRAS E SERVIĮOS DE NAVEGANTES/SC,;Homologada;94;2024;06/09/2024 09:00;9EA73A75940B8EFF877F228AC6A9A3858E432979;;320720.19;278568.85
MUNICIPIO DE NAVEGANTES;Inexigibilidade - Lei 14.133/2021;92;2024;Normal - (Nova Lei de Licitaįões);AQUISIĮÃO DE ESCOLINHA DE TRÂNSITO MÓVEL A SER DESTINADO PARA O CMEI PROFŠ BERNARDETE MARIA SEDREZ DA SILVA, BAIRRO CENTRO, CONFORME EMENDA PARLAMENTAR, ATRAVÉS DA SECRETARIA MUNICIPAL DE EDUCAĮÃO DO MUNICÍPIO DE NAVEGANTES, SC;Homologada;92;2024;;;IL92/2024;12150.00;12150.00
MUNICIPIO DE NAVEGANTES;Inexigibilidade - Lei 14.133/2021;91;2024;Normal - (Nova Lei de Licitaįões);INEXIGIBILIDADE DE LICITAĮÃO VISANDO A CONTRATAĮÃO SHOW ARTÍSTICO MUSICAL COM A DUPLA LUCAS E BIANCHI A SER REALIZADO NO DIA 31/12/2024, COM INÍCIO PREVISTO PARA AS 21H00MIN NA PRAIA CENTRAL E/OU ARENA DE EVENTOS COM DURAĮÃO MÍNIMA DE 2HORAS00MINUTOS, DE ACORDO COM O CALENDÁRIO DE FESTIVIDADES DO RÉVEILLON 2024/2025, POR MEIO DA SECRETARIA MUNICIPAL DE TURISMO, CULTURA E ESPORTES.;Homologada;91;2024;;;IL91/2024;15200.00;15200.00
MUNICIPIO DE NAVEGANTES;Dispensa Presencial - Lei 14.133/2021;90;2024;Normal - (Nova Lei de Licitaįões);CONTRATAĮÃO DE SERVIĮO DE CHAVEIRO PARA ATENDER AS DEMANDAS DA PREFEITURA MUNICIPAL DE NAVEGANTES, ATRAVÉS DA SECRETARIA DE ADMINISTRAĮÃO E LOGÍSTICA.;Homologada;90;2024;;;DL90/2024;500.00;500.00
MUNICIPIO DE NAVEGANTES;Pregão Eletrônico - Lei 14.133/2021;89;2024;Registro de Preįo - (Nova Lei de Licitaįões);LICITAĮÃO DESTINADA EXCLUSIVAMENTE Ā MEI, MICROEMPRESA E EMPRESA DE PEQUENO PORTE - PREGÃO ELETRÔNICO PARA REGISTRO DE PREĮO VISANDO A AQUISIĮÃO DE GĘNEROS ALIMENTÍCIOS PARA COFFEE BREAK DESTINADOS AOS EVENTOS REALIZADOS PELA ADMINISTRAĮÃO PÚBLICA DO MUNICÍPIO DE NAVEGANTES/SC.;Homologada;89;2024;16/09/2024 14:00;BDBE845FF2B126CEE6442936DDF6AE827BB71538;;85678.50;61052.50
MUNICIPIO DE NAVEGANTES;Inexigibilidade - Lei 14.133/2021;88;2024;Normal - (Nova Lei de Licitaįões);CONTRATAĮÃO LICENCIAMENTO DE USO, HOSPEDAGEM, SUPORTE TÉCNICO, CUSTOMIZAĮÕES, TREINAMENTOS DO SOFTWARE SISAMSIG (TIMONEIRO) VERSÃO 2.0 E SEUS MÓDULOS AO MUNICÍPIO DE NAVEGANTES PARA ACOMPANHAMENTO, AUDITORIA, INSPEĮÃO E GESTÃO DO MOVIMENTO ECONÔMICO MUNICIPAL, PARA ATENDER A DEMANDA DA SECRETARIA DE DESENVOLVIMENTO ECONÔMICO E RECEITA, POR MEIO DO MOVEC/NAVEGANTES, NOS TERMOS DA TABELA ABAIXO, CONFORME CONDIĮÕES E EXIGĘNCIAS ESTABELECIDAS NESTE INSTRUMENTO;Homologada;88;2024;;;IL88/2024;181079.04;181079.04
MUNICIPIO DE NAVEGANTES;Concorręncia Eletrônica - Lei 14.133/2021;86;2024;Normal - (Nova Lei de Licitaįões);CONTRATAĮÃO DE EMPRESA ESPECIALIZADA PARA A PRESTAĮÃO DE SERVIĮOS DE PAVIMENTAĮÃO COM LAJOTA SEXTAVADA, DRENAGEM PLUVIAL E SINALIZAĮÃO VIÁRIA DA RUA JOÃO DOMINGOS DA COSTA, NO BAIRRO CENTRO, CONFORME PROJETOS, MEMORIAL DESCRITIVO, PLANILHA ORĮAMENTÁRIA E CRONOGRAMA FÍSICO-FINANCEIRO, através da Secretaria Municipal de Obras/SC;Homologada;86;2024;06/09/2024 14:00;2A21C34BE3EC96467E9D4E00090B8207E5553954;;432170.14;293499.00
MUNICIPIO DE NAVEGANTES;Pregão Eletrônico - Lei 14.133/2021;85;2024;Registro de Preįo - (Nova Lei de Licitaįões);PREGÃO ELETRÔNICO PARA REGISTRO DE PREĮOS VISANDO A CONTRATAĮÃO DE EMPRESA ESPECIALIZADA EM PRESTAĮÃO DE SERVIĮOS DE LOCAĮÃO, FORNECIMENTO, TRANSPORTE, INSTALAĮÃO, RETIRADA, ARMAZENAMENTO, MANUTENĮÃO E SUBSTITUIĮÃO DAS FIGURAS EM FIBRAS E DA ILUMINAĮÃO NATALINA PARA A PROGRAMAĮÃO DO NATAL DE ENCANTOS DE 2024 DO MUNICÍPIO DE NAVEGANTES/SC, QUE REALIZAR-SE-Á NOS DIAS 23/11/2024 Ā 03/01/2025  PROMOVIDO PELA SECRETARIA DE TURISMO DO MUNICÍPIO DE NAVEGANTES/SC, CONFORME ESPECIFICAĮÕES, QUANTIDADES, CONDIĮÕES CONSTANTES NO EDITAL E TERMO DE REFERĘNCIA E ANEXOS;Homologada;85;2024;30/08/2024 14:00;F640E72FD3A621112F55FACAFC92F7AF6752B5DE;;3276271.71;2080000.00
MUNICIPIO DE NAVEGANTES;Pregão Eletrônico - Lei 14.133/2021;84;2024;Normal - (Nova Lei de Licitaįões);LICITAĮÃO DESTINADA EXCLUSIVAMENTE Ā MEI, MICROEMPRESA E EMPRESA DE PEQUENO PORTE - PREGÃO ELETRÔNICO VISANDO A CONTRATAĮÃO DE EMPRESA ESPECIALIZADA EM PRESTAĮÃO DE SERVIĮOS DE DECORAĮÃO PARA REALIZAĮÃO DA CERIMÔNIA DO CASAMENTO COLETIVO, A SER REALIZADO NO DIA 24 DE AGOSTO DE 2024, ATRAVÉS DA SECRETARIA DE ASSISTĘNCIA SOCIAL DE NAVEGANTES/SC.;Homologada;84;2024;02/08/2024 09:00;F2A5783155FA09476545424C71A8DC31BB191773;;13612.33;12900.00
MUNICIPIO DE NAVEGANTES;Concorręncia Eletrônica - Lei 14.133/2021;83;2024;Normal - (Nova Lei de Licitaįões);CONCORRENCIA ELETRÔNICA VISANDO A CONTRATAĮÃO DE EMPRESA ESPECIALIZADA PARA A PRESTAĮÃO DE SERVIĮOS DE PAVIMENTAĮÃO ASFÁLTICA, DRENAGEM PLUVIAL E SINALIZAĮÃO VIÁRIA DA RUA RAULINO COUTO, NO BAIRRO MACHADOS, CONFORME PROJETOS, MEMORIAL DESCRITIVO, PLANILHA ORĮAMENTÁRIA E CRONOGRAMA FÍSICO-FINANCEIRO.;Homologada;83;2024;14/08/2024 14:00;7A9A5F4250A5EE49C400597F887CAA74275B5529;;5906196.96;4513000.00
MUNICIPIO DE NAVEGANTES;Pregão Eletrônico - Lei 14.133/2021;82;2024;Registro de Preįo - (Nova Lei de Licitaįões);PREGÃO ELETRÔNICO PARA REGISTRO DE PREĮOS VISANDO A CONTRATAĮÃO DE EMPRESA ESPECIALIZADA PARA LOCAĮÃO DE FLUTUANTES, CONTEMPLANDO OS SERVIĮOS DE TRANSPORTE, INSTALAĮÃO, DESINSTALAĮÃO E MANUTENĮÃO DURANTE TODO O PERÍODO EM QUE ESTIVER Ā DISPOSIĮÃO DA SECRETARIA MUNICIPAL DE TURISMO, CULTURA E ESPORTE.;Homologada;82;2024;25/07/2024 14:00;6B8FBA4B301A068DC5984537AE3FE1A5EF08AE89;;154100.00;152000.00
MUNICIPIO DE NAVEGANTES;Pregão Eletrônico - Lei 14.133/2021;81;2024;Registro de Preįo - (Nova Lei de Licitaįões);PREGÃO ELETRÔNICO PARA REGISTRO DE PREĮOS VISANDO A AQUISIĮÃO DE MATERIAIS E EQUIPAMENTOS DE SEGURANĮA CONTRA INCĘNDIO E MANUTENĮÃO DE EXTINTORES PARA O MUNICÍPIO DE NAVEGANTES/SC.;Homologada;81;2024;22/07/2024 14:00;EADC439C5100BDAC2183A3A6213451DE5BDD235A;;3177842.88;2287708.20
MUNICIPIO DE NAVEGANTES;Inexigibilidade - Lei 8.666/1993;80;2024;Normal;Contrataįão de empresa para locaįão de software de sistema de GESTÃO DE OBRAS PÚBLICAS INTEGRADO, destinado ā Secretaria de Planejamento e Meio Ambiente e a Secretaria de Estradas, Obras e Serviįos Urbanos.;Homologada;80;2024;;;OU80/2024;192442.76;192442.76
MUNICIPIO DE NAVEGANTES;Pregão Eletrônico - Lei 14.133/2021;79;2024;Normal - (Nova Lei de Licitaįões);PREGÃO ELETRÔNICO VISANDO A CONTRATAĮÃO DE EMPRESA PARA PRESTAĮÃO DE SERVIĮO DE GESTÃO PATRIMONIAL COM O LEVANTAMENTO FÍSICO E INDIVIDUALIZADO DOS BENS PATRIMONIAIS MÓVEIS, A FIM DE CONFERĘNCIA E ATUALIZAĮÃO DE SISTEMA, ATRAVÉS DA SECRETARIA DE ADMINISTRAĮÃO E LOGÍSTICA DO MUNICIPIO DE  NAVEGANTES/SC.;Homologada;79;2024;27/08/2024 14:00;5618683CDA6E1E13354E0409C3455D596A439381;;416192.00;295000.00
MUNICIPIO DE NAVEGANTES;A Definir;78;2024;Normal;ADESÃO Ā ATA DE REGISTRO DE PREĮO DO PREGÃO ELETRÔNICO 06/2023/FNDE/MEC - SOLICITAĮÃO SIGARP Nš 99830, AQUISIĮÃO DE ÔNIBUS RURAL ESCOLAR (ORE 3) - TRANSMISSÃO MECÂNICA, PARA SER UTILIZADO NO TRANSPORTE DE ALUNOS DA REDE  MUNICIPAL DE ENSINO, ATRAVÉS  DA  SECRETARIA  DE EDUCAĮÃO DO MUNICÍPIO DE NAVEGANTES/SC EM PARCERIA COM O GOVERNO FEDERAL.;Homologada;78;2024;;;;469499.00;469499.00
MUNICIPIO DE NAVEGANTES;Pregão Eletrônico - Lei 14.133/2021;76;2024;Registro de Preįo - (Nova Lei de Licitaįões);PREGÃO ELETRÔNICO PARA REGISTRO DE PREĮO VISANDO A CONTRATAĮÃO DE PESSOA JURÍDICA PARA PRESTAĮÃO DE SERVIĮOS DE LOCAĮÃO DE CAMINHÃO CARROCERIA BAÚ, E CAMINHÃO CARROCERIA ABERTA, INCLUINDO MOTORISTA, DEVIDAMENTE HABILITADO, PARA ATENDER A DEMANDA DO ALMOXARIFADO CENTRAL DA SECRETARIA MUNICIPAL DE EDUCAĮÃO DE NAVEGANTES/SC .;Homologada;76;2024;10/09/2024 14:00;E251FDFB4F37B46DB422984C97A5AAD63D3BE92B;;418800.00;252000.00
MUNICIPIO DE NAVEGANTES;Pregão Eletrônico - Lei 14.133/2021;75;2024;Registro de Preįo - (Nova Lei de Licitaįões);LICITAĮÃO DESTINADA EXCLUSIVAMENTE Ā MEI, MICROEMPRESA E EMPRESA DE PEQUENO PORTE, PREGÃO ELETRÔNICO PARA REGISTRO DE PREĮO VISANDO CONTRATAĮÃO DE EMPRESA ESPECIALIZADA PARA FORNECIMENTO DE ETIQUETAS DE IDENTIFICAĮÃO PATRIMONIAL, DE FORMA CONTÍNUA, PARA CONTROLE DOS BENS MUNICIPAIS, ATRAVÉS DA SECRETARIA DE ADMINISTRAĮÃO E LOGÍSTICA DO MUNICÍPIO DE NAVEGANTES/SC.;Homologada;75;2024;16/07/2024 14:00;2E0F4B6EB54A3BFE68A17DC4AC80E9C8654A665A;;22400.00;9800.00
MUNICIPIO DE NAVEGANTES;Pregão Eletrônico - Lei 14.133/2021;74;2024;Normal - (Nova Lei de Licitaįões);Pregão eletrônico visando a contrataįão de empresa especializada em tecnologia da informaįão para cessão de uso de software de sistema de controle interno para a gestão pública, compreendendo serviįos de processamento de dados, gerenciamento de banco de dados, planejamento e implantaįão do sistema, através da Secretaria Municipal de Gestão e Controle do Município de Navegantes/SC.;Homologada;74;2024;23/08/2024 09:00;718FC20C906199B5520F87CB4017407D16BCDE86;;52168.00;42000.00
MUNICIPIO DE NAVEGANTES;Pregão Eletrônico - Lei 14.133/2021;73;2024;Registro de Preįo - (Nova Lei de Licitaįões);AQUISIĮÃO DE FERRAMENTAS, EQUIPAMENTOS E INSUMOS A SEREM UTILIZADOS NA REALIZAĮÃO DOS SERVIĮOS DE ELÉTRICA, ATRAVÉS DA SECRETARIA DE OBRAS E SERVIĮOS MUNICIPAIS DE NAVEGANTES/SC.;Homologada;73;2024;05/07/2024 14:00;A6601B0D4C7D432CA6E8F3BD2BDEFED2C73F5659;;81266.05;60990.40
MUNICIPIO DE NAVEGANTES;Pregão Eletrônico - Lei 14.133/2021;72;2024;Registro de Preįo - (Nova Lei de Licitaįões);PREGÃO ELETRÔNICO PARA REGISTRO DE PREĮO VISANDO  AQUISIĮÃO DE DISPOSITIVOS MULTIPORTAS ROUTERBOARD ETHERNET ROUTER, MODELO RB3011UIAS+RM, COM LICENĮA MÍNIMA DO ROUTEROS NÍVEL 5, FONTE COMPATÍVEL INCLUSA, KIT DE MONTAGEM EM RACK INCLUSA, MARCA MIKROTIK, E DISPOSITIVOS DE PONTOS DE ACESSO A REDE SEM FIO, MODELO UNIFI UAP-AC-LR 2.4/5.0 GHZ, COM INJETOR DE POE INCLUSO, MARCA UBIQUITI.;Homologada;72;2024;31/07/2024 09:00;C727D88F608F31C47C10D8C4E3A0174B0381CA96;;1025539.50;747144.00
MUNICIPIO DE NAVEGANTES;Pregão Eletrônico - Lei 14.133/2021;71;2024;Normal - (Nova Lei de Licitaįões);PREGÃO ELETRÔNICO VISANDO A CONTRATAĮÃO DE EMPRESA ESPECIALIZADA EM LOCAĮÃO DE ESTRUTURA PARA A REALIZAĮÃO DO 2š FESTIVAL NÁUTICO DE REGATA DE VELAS DE NAVEGANTES COPA NÁUTICA QUE SERA REALIZADA NOS DIAS 23,24 E 25 DE AGOSTO, CONFORME ESPECIFICAĮÕES, E EXIGĘNCIAS ESTABELECIDAS NO TERMO DE REFERĘNCIA;Homologada;71;2024;08/08/2024 14:00;8B499347D4239E6F3936E4E9FA850EF4FC7F5CFB;;225948.00;206789.97
MUNICIPIO DE NAVEGANTES;Dispensa Presencial - Lei 14.133/2021;70;2024;Normal - (Nova Lei de Licitaįões);DISPENSA DE LICITAĮÃO VISANDO A CONTRATAĮÃO DE SERVIĮO PARA DISPONIBILIZAĮÃO DE SISTEMA ELETRONICO DE LICITAĮÕES , DENOMINADO PLATAFORMA LICITAR DIGITAL.;Homologada;70;2024;;;DL70/2024;0.01;0.01
MUNICIPIO DE NAVEGANTES;Dispensa Presencial - Lei 14.133/2021;69;2024;Normal - (Nova Lei de Licitaįões);COMPRA DIRETA DE 01 (UMA) CADEIRA POSTURAL INFANTIL, PARA ATENDER AS NECESSIDADES DE UM ALUNO PORTADOR DE PARALISIA CEREBRAL DO C.M.E.I. PORTAL DO SABER, ATRAVÉS DA SECRETARIA MUNICIPAL DE EDUCAĮÃO.;Homologada;69;2024;;;DL69/2024;1700.00;1700.00
MUNICIPIO DE NAVEGANTES;Pregão Eletrônico - Lei 14.133/2021;68;2024;Registro de Preįo - (Nova Lei de Licitaįões);REGISTRO DE PREĮO, PARA CONTRATAĮÃO DE SERVIĮO DE CERTIFICAĮÃO DIGITAL PARA USUÁRIOS, EQUIPAMENTOS E INSTITUCIONAL DENTRO DAS ESPECIFICAĮÕES E NORMAS ICP-BRASIL, INCLUINDO O FORNECIMENTO DE DISPOSITIVOS PARA ARMAZENAMENTO DE CERTIFICADOS DIGITAIS DO TIPO TOKEN USB E CERTIFICADOS INTALÁVEIS NO COMPUTADOR, TIPO PFX PARA E-CPF, E-CNPJ, PARA ATENDER AS NECESSIDADES DA PREFEITURA MUNICIPAL DE NAVEGANTES (SC), SUAS SECRETARIAS, FUNDOS, FUNDAĮÕES E INSTITUTOS;Homologada;68;2024;08/07/2024 14:00;F07CB50841F0D788ED281967F2630580E50295FE;;20201.10;15345.00
MUNICIPIO DE NAVEGANTES;Dispensa Presencial - Lei 14.133/2021;67;2024;Normal - (Nova Lei de Licitaįões);"DISPENSA DE LICITAĮÃO VISANDO A CONTRATAĮÃO DE EMPRESA ESPECIALIZADA EM COLETA, TRANSPORTE E DESTINAĮÃO FINAL DOS RESÍDUOS SÓLIDOS URBANOS DOMICILIARES E COMERCIAIS; COLETA SELETIVA; BEM COMO COLETA, TRANSPORTE, TRATAMENTO E DESTINAĮÃO FINAL DOS RESÍDUOS, NO TERRITÓRIO MUNICIPAL.";Homologada;67;2024;;;DL67/2024;17601942.48;17601942.48
