Unidade Gestora;Modalidade;Licitaįão - Número;Licitaįão - Ano;Tipo de Concorręncia;Objeto;Situaįão;Processo Administrativo - Número;Processo Administrativo - Ano;Abertura das Propostas;TCE - Registro;TCE - Número Processo Termo;Valor - Estimado;Valor - Homologado
MUNICIPIO DE NAVEGANTES;Pregão Eletrônico - Lei 14.133/2021;13;2026;Registro de Preįo - (Nova Lei de Licitaįões);CONTRATAĮÃO DE EMPRESA ESPECIALIZADA EM PRESTAĮÃO DE SERVIĮOS DE LOCAĮÃO DE MOTONIVELADORA SEM MOTORISTA/ OPERADOR, PARA AUXILIAREM NAS ATIVIDADES DIÁRIAS DA SECRETARIA DE INFRAESTRUTURA DO MUNICÍPIO DE NAVEGANTES/SC.;Aberta;13;2026;23/03/2026 09:00;E757B5C57F0FA42C264FEC6E513064BDF1E151B6;13/2026 - PRE;1185124.32;
MUNICIPIO DE NAVEGANTES;Dispensa Eletrônica - Lei 14.133/2021;12;2026;Normal - (Nova Lei de Licitaįões);DISPENSA ELETRÔNICA EMERGENCIAL PARA CONTRATAĮÃO DE EMPRESA PARA LIMPEZA E CONSERVAĮÃO URBANA BEM COMO A LIMPEZA E CONSERVAĮÃO DA PRAIA DO MUNICÍPIO.;Homologada;12;2026;;4E51B10F278F59154384AA1D9E0CFCCCEA3B9750;12/2026 - PRD;8181102.46;4914440.51
MUNICIPIO DE NAVEGANTES;Pregão Eletrônico - Lei 14.133/2021;10;2026;Registro de Preįo - (Nova Lei de Licitaįões);CONTRATAĮÃO DE EMPRESA ESPECIALIZADA PARA PRESTAĮÃO DE SERVIĮOS DE DESTINAĮÃO FINAL DE RESÍDUOS DE LIXO/ENTULHOS, MÓVEIS INSERVÍVEIS DESCARTADOS PELOS MUNÍCIPES, ROĮAGEM, CAPINAĮÃO, RESTOS DE PODAS DE ÁRVORES, RESÍDUOS DE OBRAS DE CONSTRUĮÃO CIVIL PROVENIENTES DAS REPARTIĮÕES PÚBLICAS EXECUTADAS PELO MUNICÍPIO, LIMPEZA DE ÁREAS PÚBLICAS E LIMPEZA DA PRAIA, ATRAVÉS DA SECRETARIA MUNICIPAL DE INFRAESTRUTURA DE NAVEGANTES/SC;Aberta;10;2026;13/03/2026 09:00;1997F551B4E48880C0E272ADCFE366D9F76192FD;10/2026 - PRE;8843470.00;
MUNICIPIO DE NAVEGANTES;Pregão Eletrônico - Lei 14.133/2021;9;2026;Registro de Preįo - (Nova Lei de Licitaįões);REGISTRO DE PREĮOS PARA A AQUISIĮÃO DE PAPEL A4 PARA ATENDIMENTO DAS DEMANDAS DAS SECRETARIAS, FUNDOS, FUNDAĮÕES E INSTITUTOS DO MUNICÍPIO DE NAVEGANTES.;Homologada;9;2026;02/03/2026 09:00;D113D54F3813D17DE9AFEBC0D191B98971519C31;9/2026 - PRE;593720.00;443300.00
MUNICIPIO DE NAVEGANTES;Pregão Eletrônico - Lei 14.133/2021;5;2026;Registro de Preįo - (Nova Lei de Licitaįões);CONTRATAĮÃO DE EMPRESA ESPECIALIZADA PARA PRESTAĮÃO DE SERVIĮOS DE CABEAMENTO DE REDE LÓGICA ESTRUTURADA E INFRAESTRUTURA FÍSICA ASSOCIADA, SEM FORNECIMENTO DE MATERIAIS, MEDIDOS POR HORA TÉCNICA E SOB DEMANDA, CONFORME CONDIĮÕES E EXIGĘNCIAS ESTABELECIDAS NESTE INSTRUMENTO, PARA AS SECRETARIAS, FUNDOS E FUNDAĮÕES DO MUNICÍPIO, ATRAVÉS DA SECRETARIA DE PLANEJAMENTO, ADMINISTRAĮÃO E FINANĮAS DA PREFEITURA DE NAVEGANTES/SC.;Aberta;5;2026;27/02/2026 09:00;D7DE23F427B83B348732C527742D58244D9B589C;5/2026 - PRE;968520.00;
MUNICIPIO DE NAVEGANTES;Pregão Eletrônico - Lei 14.133/2021;4;2026;Normal - (Nova Lei de Licitaįões);PERMISSÃO DE USO DE ESPAĮO PÚBLICO, A TÍTULO ONEROSO, PARA A OCUPAĮÃO, OPERAĮÃO E EXPLORAĮÃO DE ESTANDE DE CHOPP DURANTE O CARNAVAL DE NAVEGANTES, INCLUINDO A UTILIZAĮÃO DA INFRAESTRUTURA DISPONIBILIZADA NO ESPAĮO DA VILA DO CHOPP.;Suspensa;4;2026;12/02/2026 09:00;2CC18A807A97AC2D958170F76290D24F5B3E01EE;4/2026 - PRE;244385.62;
MUNICIPIO DE NAVEGANTES;Dispensa Presencial - Lei 14.133/2021;3;2026;Normal - (Nova Lei de Licitaįões);ACOLHIMENTO DE PESSOA COM DEFICIENCIA EM SITUAĮÃO DE RUA .;Homologada;3;2026;;4C96133A208A14A87B09DE12990415D204F7468D;3/2026 - PRD;126000.00;126000.00
MUNICIPIO DE NAVEGANTES;Pregão Eletrônico - Lei 14.133/2021;2;2026;Registro de Preįo - (Nova Lei de Licitaįões);Registro de preįos para a contrataįão de empresa especializada em fornecimento de materiais de comunicaįão visual para atendimento das demandas das Secretarias, Fundos, Fundaįões e Institutos do Município de Navegantes/SC.;Homologada;2;2026;03/02/2026 09:00;4E11CF8818124A96F6C9139345D9018888B138B9;2/2026 - PRE;1217740.00;797110.00
MUNICIPIO DE NAVEGANTES;Inexigibilidade - Lei 14.133/2021;1;2026;Normal - (Nova Lei de Licitaįões);Locaįão de 01 (um) imóvel, localizado no Bairro Machados, no Município de Navegantes/SC, destinado ā instalaįão e ao funcionamento de unidade educacional da rede municipal de ensino, visando atender ās demandas da Secretaria de Educaįão. ;Homologada;259;2025;;57A7AA4E4A9F4FCB60FCAAF6D991658C1E8A6193;1/2026 - PRI;1692000.00;1692000.00
MUNICIPIO DE NAVEGANTES;Pregão Eletrônico - Lei 14.133/2021;258;2025;Registro de Preįo - (Nova Lei de Licitaįões);Contrataįão de empresa especializada para prestaįão de serviįos (com fornecimento de mão de obra, maquinário e ferramentas) destinados ā execuįão de pavimentaįão com blocos intertravados, incluindo a colocaįão e remoįão de lajotas, pavers, meio-fio, boca de lobo e serviįo de topografia, nas vias e locais públicos do município de Navegantes, através da Secretaria Municipal de Infraestrutura.;Homologada;258;2025;12/02/2026 09:00;A45F7FE7FAB55DB1AA5B4F18C6DFE6E6C9717AEF;258/2025 - PRE;6110800.00;3038000.00
MUNICIPIO DE NAVEGANTES;Dispensa Presencial - Lei 14.133/2021;257;2025;Normal - (Nova Lei de Licitaįões);Contrataįão de certificado digital equipamento, modelo A1, para utilizaįão nosistema InfoConv.;Homologada;257;2025;;52C4F836BF1064E906BAD1C01DE8BB9FE46D11C6;257/2025 - PRD;1181.30;1181.30
MUNICIPIO DE NAVEGANTES;Inexigibilidade - Lei 14.133/2021;256;2025;Normal - (Nova Lei de Licitaįões);CONTRATAĮÃO DE PRODUTOS E SERVIĮOS POR MEIO DE PACOTE DE SERVIĮOS DOS CORREIOS MEDIANTE ADESÃO AO TERMO DE CONDIĮÕES COMERCIAIS, QUE PERMITE A COMPRA DE PRODUTOS E UTILIZAĮÃO DOS DIVERSOS SERVIĮOS EXCLUSIVOS DOS CORREIOS POR MEIO DOS CANAIS DE ATENDIMENTO DISPONIBILIZADOS.;Homologada;256;2025;;138FC09296511077A68EB760ED27CFAAD4C0914A;256/2025 - PRI;184999.35;184999.35
MUNICIPIO DE NAVEGANTES;Pregão Eletrônico - Lei 14.133/2021;254;2025;Registro de Preįo - (Nova Lei de Licitaįões);"PREGÃO ELETRÔNICO PARA CONTRATAĮÃO DE EMPRESA ESPECIALIZADA NO FORNECIMENTO, MONTAGEM, DESMONTAGEM E GESTÃO OPERACIONAL DAS ESTRUTURAS DO EVENTO &#8220;VILA DO VÔLEI&#8221;, POR INTERMÉDIO DA SECRETARIA MUNICIPAL DE TURISMO";Homologada;254;2025;14/01/2026 09:00;D201D43E115C9A31AA0E9AC1E247CE2E259AC127;254/2025 - PRE;1727359.39;502000.00
MUNICIPIO DE NAVEGANTES;Pregão Eletrônico - Lei 14.133/2021;253;2025;Registro de Preįo - (Nova Lei de Licitaįões);REGISTRO DE PREĮOS PARA CONTRATAĮÃO DE EMPRESA PARA PRESTAĮÃO DE SERVIĮOS DE PUBLICAĮÃO LEGAIS EM JORNAL DIÁRIO DE CIRCULAĮÃO REGIONAL, POR MEIO DA SECRETARIA DE PLANEJAMENTO, ADMINISTRAĮÃO E FINANĮAS;Homologada;253;2025;29/01/2026 09:00;31AA1CE747969ED94D4BF6AEB05841A4FC7DBE45;253/2025 - PRE;200000.00;29900.00
MUNICIPIO DE NAVEGANTES;Inexigibilidade - Lei 8.666/1993;253;2025;Credenciamento/Chamamento;CHAMAMENTO PÚBLICO VISANDO A SELEĮÃO DE OSCs INTERESSADAS A FIRMAR TERMO DE COLABORAĮÃO COM ENTIDADES QUE ATUAM NA CAUSA ANIMAL, COM RESGATES, LAR TEMPORÁRIO, ADOĮÃO, ESSE CASO CASTRAĮÕES, VACINAS, COMPRA DE RAĮÕES, ATENDIMENTO VETERINÁRIO, MEDICAĮÃO, PRODUTOS DE LIMPEZA, PRODUTOS PARA DESINFECTAĮÃO DE PARASITAS E CASINHAS PARA ABRIGO E AFINS, EM CUMPRIMENTO DA EMENDA IMPOSITIVA Nš 152/2024.;Homologada;159;2025;;;253/2025 - PRI;50000.00;100000.00
MUNICIPIO DE NAVEGANTES;Inexigibilidade - Lei 8.666/1993;252;2025;Credenciamento/Chamamento;CHAMAMENTO PÚBLICO PARA GERENCIAMENTO, OPERACIONALIZAĮÃO E EXECUĮÃO DO SERVIĮO DE PROTEĮÃO SOCIAL ESPECIAL DE ALTA COMPLEXIDADE PARA ACOLHIMENTO INSTITUCIONAL DE CRIANĮAS DE 0 A 12 INCOMPLETOS (GĘNEROS MASCULINO E FEMININO) NA MODALIDADE ABRIGO INSTITUCIONAL COM CAPACIDADE PARA 16 ACOLHIMENTOS SIMULTÂNEOS, ATRAVÉS DA SECRETARIA DE INCLUSÃO E DESENVOLVIMENTO SOCIAL.;Homologada;86;2025;;;;1719467.36;1719467.36
MUNICIPIO DE NAVEGANTES;Inexigibilidade - Lei 14.133/2021;251;2025;Credenciamento - (Nova Lei de Licitaįões);FORNECIMENTO DE  SINAL DE INTERNET SEM FIO (WI-FI) EM REGIME DE COMODATO, CONTENDO 01 (UM) PONTO DE ACESSO E VELOCIDADE MÍNIMA DE 500MBPS (TANTO DE DOWNLOAD QUANTO DE UPLOAD), DURANTE OS EVENTOS: ARENA DE VERÃO A REALIZAR-SE NO PERÍODO DE  20/12/2025 A 01/02/2026 E 1Š ETAPA DO CIRCUITO BRASILEIRO DE VÔLEI DE PRAIA EM 31/01/2026 A 08/02/2026;Homologada;251;2025;;DE133EB09BD310924603E7462FD298DA5E32438F;251/2025 - PRI;0.02;0.02
MUNICIPIO DE NAVEGANTES;Pregão Eletrônico - Lei 14.133/2021;249;2025;Registro de Preįo - (Nova Lei de Licitaįões);CONTRATAĮÃO DE EMPRESA ESPECIALIZADA PARA PRESTAĮÃO DE SERVIĮOS DE DESTINAĮÃO FINAL DE RESÍDUOS DE LIXO/ENTULHOS, MÓVEIS INSERVÍVEIS DESCARTADOS PELOS MUNÍCIPES, ROĮAGEM, CAPINAĮÃO, RESTOS DE PODAS DE ÁRVORES, RESÍDUOS DE OBRAS DE CONSTRUĮÃO CIVIL PROVENIENTES DAS REPARTIĮÕES PÚBLICAS EXECUTADAS PELO MUNICÍPIO, LIMPEZA DE ÁREAS PÚBLICAS E LIMPEZA DA PRAIA, ATRAVÉS DA SECRETARIA MUNICIPAL DE INFRAESTRUTURA DE NAVEGANTES/SC.;Fracassada;249;2025;12/01/2026 09:00;F4FECBEE1E69FA71BE94A00DD8D0B1468F189A06;249/2025 - PRE;5831580.00;
MUNICIPIO DE NAVEGANTES;Pregão Eletrônico - Lei 14.133/2021;247;2025;Registro de Preįo - (Nova Lei de Licitaįões);AQUISIĮÃO DE MATERIAIS (TAMPAO EM CONCRETO E CAIXA DE PASSAGEM EM CONCRETO ARMADO), PARA USO NAS MANUTENĮÕES DAS VIAS PÚBLICAS E REPAROS DA REDE PLUVIAL DO MUNICÍPIO, ATRAVÉS DA SECRETARIA MUNICIPAL DE INFRAESTRUTURA DE NAVEGANTES/SC - ITENS FRACASSADOS NO PREGÃO ELETRÔNICO Nš 105/2025.;Homologada;247;2025;18/12/2025 09:00;F42EF3EC3A9A57F74116C1E204704B8439EB64AB;247/2025 - PRE;1036600.40;1036096.00
MUNICIPIO DE NAVEGANTES;Concorręncia Eletrônica - Lei 14.133/2021;246;2025;Normal - (Nova Lei de Licitaįões);CONTRATAĮÃO DE EMPRESA ESPECIALIZADA PARA PRESTAĮÃO DE SERVIĮOS DE CONSTRUĮÃO DE 02 (DOIS) POSTOS SALVA-VIDAS, SITUADO NA AV. PREFEITO CIRINO ADOLFO CABRAL, CONFORME PROJETOS, MEMORIAL DESCRITIVO, PLANILHA ORĮAMENTÁRIA E CRONOGRAMA FÍSICO-FINANCEIRO;Homologada;246;2025;04/12/2025 09:00;2462164ADA00C6439D6E4C312E871C895486C166;246/2025 - CNC;466313.42;452000.00
MUNICIPIO DE NAVEGANTES;Pregão Eletrônico - Lei 14.133/2021;245;2025;Registro de Preįo - (Nova Lei de Licitaįões);"Aquisiįão de materiais KIT PESCADOR para atender a Lei nš 3603/2021 de 30 de novembro de
2021 que implanta o Programa de Auxilio ao Pescador Artesanal através da Secretaria de
Agricultura Pesca e Pecuária.JUSTIFICATIVA: Aquisiįão de materiais para compor o Kit Pescador, para atender ā Lei nš 3603/2021 de 30 de novembro de 2021, que implantou o Programa de Auxilio ao Pescador Artesanal, através da Secretaria de Agricultura, Pesca e Pecuária, nos termos da tabela abaixo, conforme condiįões e exigęncias estabelecidas neste instrumento.NOME DO SOLICITANTE: caroline fernandes freitas";Homologada;245;2025;07/01/2026 09:00;7D7C585C346EC45E794457A8C948D2B6E4971E1B;245/2025 - PRE;57585.50;42573.30
MUNICIPIO DE NAVEGANTES;Pregão Eletrônico - Lei 14.133/2021;244;2025;Normal - (Nova Lei de Licitaįões);Fornecimento de kits de robótica educacional, acompanhados de materiais didáticos, plataforma digital e formaįão técnico-pedagógica, destinados ās escolas da Rede Municipal de Ensino de Navegantes/SCNOME DO SOLICITANTE: NATALLY LOUISE OLIVEIRA FRANCISCO;Fracassada;244;2025;02/03/2026 09:00;4912DB646F8359E9999E2FEA96BBA5963F1B8092;244/2025 - PRE;245480.65;
MUNICIPIO DE NAVEGANTES;Inexigibilidade - Lei 14.133/2021;243;2025;Normal - (Nova Lei de Licitaįões);INEXIGIBILIDADE DE LICITAĮÃO VISANDO A CONTRATAĮÃO  DE SHOW ARTÍSTICO MUSICAL COM A BANDA MASKAVO A SER REALIZADO NO DIA 10/01/2026, COM INÍCIO PREVISTO PARA AS 20H00MIN NA ARENA DE VERÃO COM DURAĮÃO MÍNIMA DE 01H30MIN, DE ACORDO COM O CALENDÁRIO DE FESTIVIDADES DA TEMPORADA DE VERÃO, POR MEIO DA SECRETARIA MUNICIPAL DE TURISMO.;Homologada;238;2025;;38EC57755830DD42518618EAA4CF1293024F00C6;243/2025 - PRI;50000.00;50000.00
MUNICIPIO DE NAVEGANTES;Pregão Eletrônico - Lei 14.133/2021;243;2025;Registro de Preįo - (Nova Lei de Licitaįões);Pregão Eletrônico para Registro de preįos para futura e eventual contrataįão de empresa especializada em locaįão, instalaįão, manutenįão e desmobilizaįão de salas modulares tipo container para atender as demandas da Secretaria de Educaįão de Navegantes/SC;Homologada;243;2025;04/12/2025 09:00;2F7E17CC150DC91A6B04B9073EA1EC9231A15150;243/2025 - PRE;1889262.72;1611499.20
MUNICIPIO DE NAVEGANTES;Inexigibilidade - Lei 14.133/2021;242;2025;Normal - (Nova Lei de Licitaįões);INEXIGIBILIDADE DE LICITAĮÃO VISANDO CONTRATAĮÃO PARA LOCAĮÃO DE IMÓVEL PARA SEDIAR C.M.E.I. PROFESSORA ROSANA DE FÁTIMA GAYA BARRETO LOCALIZADO NO BAIRRO GRAVATÁ, CIDADE DE NAVEGANTES/SC, ATRAVÉS DA SECRETARIA MUNICIPAL DE EDUCAĮÃO DO MUNICÍPIO DE NAVEGANTES, SC;Homologada;242;2025;;1EDDA87C73B791942C815ED1E6E97E8B53CBA90B;IL242/2025;174000.00;174000.00
MUNICIPIO DE NAVEGANTES;Inexigibilidade - Lei 14.133/2021;241;2025;Normal - (Nova Lei de Licitaįões);INEXIGIBILIDADE DE LICITAĮÃO VISANDO CONTRATAĮÃO  DE SHOW ARTÍSTICO MUSICAL COM A BANDA INIMIGOS DA HP A SER REALIZADO NO DIA 18/01/2026, COM INÍCIO PREVISTO PARA AS 20H00MIN NA ARENA DE VERÃO COM DURAĮÃO MÍNIMA DE 01HORAS45MINUTOS, DE ACORDO COM O CALENDÁRIO DE FESTIVIDADES DA TEMPORADA DE VERÃO, POR MEIO DA SECRETARIA MUNICIPAL DE TURISMO;Homologada;241;2025;;40F4B67BB1524240EBCA1B61E3824097034A3B11;IL241/2025;100000.00;100000.00
MUNICIPIO DE NAVEGANTES;Inexigibilidade - Lei 14.133/2021;240;2025;Normal - (Nova Lei de Licitaįões);INEXIGIBILIDADE DE LICITAĮÃO VISANDO A CONTRATAĮÃO  DE SHOW ARTÍSTICO MUSICAL COM A BANDA CHIMARRUTS A SER REALIZADO NO DIA 24/01/2026, COM INÍCIO PREVISTO PARA AS 20H00MIN NA ARENA DE VERÃO COM DURAĮÃO MÍNIMA DE 01HORAS40MINUTOS, DE ACORDO COM O CALENDÁRIO DE FESTIVIDADES DA TEMPORADA DE VERÃO, POR MEIO DA SECRETARIA MUNICIPAL DE TURISMO;Homologada;240;2025;;6F6B2F75A30318B486BA88CAAA54F9AA4D56D9D4;IL240/2025;50000.00;50000.00
MUNICIPIO DE NAVEGANTES;Dispensa Presencial - Lei 14.133/2021;238;2025;Normal - (Nova Lei de Licitaįões);Contrataįão de empresa especializada para realizaįão de estudo técnico de análise de gestão, visando avaliar a viabilidade e a vantajosidade da contrataįão relacionada ao DABA do Municipal de Navegantes.;Homologada;248;2025;;D2D9A9AD692C8B9213D8390B281FE574495C0B99;238/2025 - PRD;40000.00;40000.00
MUNICIPIO DE NAVEGANTES;Leilão - Lei 14.133/2021;236;2025;;Realizaįão de Leilão Público de Bens Imóveis do Município de Navegantes/SC.;Aberta;236;2025;22/01/2026 09:00;58560A10A781D86D4165D25C2B9BC0BE674456DD;236/2025 - LEI;954122.87;
MUNICIPIO DE NAVEGANTES;Concorręncia Eletrônica - Lei 14.133/2021;235;2025;Normal - (Nova Lei de Licitaįões);CONCORRĘNCIA ELETRÔNICA VISANDO A CONTRATAĮÃO DE EMPRESA ESPECIALIZADA EM PRESTAĮÃO DE SERVIĮOS COM FORNECIMENTO DE MATERIAIS E MÃO DE OBRA DE PAVIMENTAĮÃO ASFÁLTICA, DRENAGEM PLUVIAL E SINALIZAĮÃO VIÁRIA DA RUA MARIA LEONOR DA CUNHA RABELLO, NO BAIRRO CENTRO, ATRAVÉS DA SECRETARIA MUNICIPAL DE INFRAESTRUTURA/SC.;Homologada;235;2025;24/11/2025 09:00;76BC3D2EB93A7CF75B0175D012CE018B4BC70A84;CE235/2025;1584514.16;1024000.00
MUNICIPIO DE NAVEGANTES;Concorręncia Eletrônica - Lei 14.133/2021;234;2025;Normal - (Nova Lei de Licitaįões);COONCORRĘNCIA ELETRONICA VISANDO A CONTRATAĮÃO DE EMPRESA ESPECIALIZADA EM PRESTAĮÃO DE SERVIĮOS PARA A EXECUĮÃO DE OBRA DE DRENAGEM PLUVIAL, INCLUINDO FORNECIMENTO DE MATERIAIS, EQUIPAMENTOS E MÃO DE OBRA DAS RUAS ADOLFO CABRAL JUNIOR, ANTÔNIO ADOLFO CABRAL, ANTÔNIO JOSÉ BATISTA, DONA MARIA CONCEIĮÃO COELHO, EDUARDO JOSÉ LEAL, JOSÉ COUTO, MALVINA SACAVÉM COUTO, MANOEL CONSTÂNCIO MAFRA, PEDRO DIONÍSIO DE SOUZA, RODOLFO FRANCISCO COUTO, SEC. JOSÉ JUAREZ DA COSTA, TOMÉ JOÃO DA VENTURA E VANDELINO LOPES FAGUNDES, ATRAVÉS DA SECRETARIA MUNICIPAL DE INFRAESTRUTURA/SC;Homologada;234;2025;28/11/2025 09:00;EA1E2B885C74A536C128DEF9E8ECB8E92AAF7134;2342025;14655624.19;9720000.00
MUNICIPIO DE NAVEGANTES;Concorręncia Eletrônica - Lei 14.133/2021;232;2025;Normal - (Nova Lei de Licitaįões);CONCORRĘNCIA ELETRÔNICA PARA CONTRATAĮÃO DE EMPRESA ESPECIALIZADA EM PRESTAĮÃO DE SERVIĮOS COM FORNECIMENTO DE MATERIAIS E MÃO DE OBRA DE PAVIMENTAĮÃO ASFÁLTICA, DRENAGEM PLUVIAL E SINALIZAĮÃO VIÁRIA DA RUA JOSÉ HONÓRIO VIEIRA, NO BAIRRO CENTRO, CONFORME PROJETOS, MEMORIAL DESCRITIVO, PLANILHA ORĮAMENTÁRIA E CRONOGRAMA FÍSICO-FINANCEIRO ATRAVÉS DA SECRETARIA DE INFRAESTRUTURA DE NAVEGANTES/SC.;Homologada;232;2025;25/11/2025 09:00;939D07EAD70BF362C7573E6E89209EEC824A639B;2322025;794058.17;592000.00
MUNICIPIO DE NAVEGANTES;Inexigibilidade - Lei 14.133/2021;231;2025;Credenciamento/Chamamento - (Nova Lei de Licitaįões);CREDENCIAMENTO   EM ACOLHIMENTO INSTITUCIONAL A MULHERES VÍTIMAS DE VIOLĘNCIA;Homologada;231;2025;;;231/2025 - PRI;720000.00;720000.00
MUNICIPIO DE NAVEGANTES;Inexigibilidade - Lei 14.133/2021;230;2025;Normal - (Nova Lei de Licitaįões);INEXIGIBILIDADE DE INSCRIĮÃO EM CURSO RELATIVO Ā IMPLANTAĮÃO DA REFORMA TRIBUTÁRIA NOS MUNICÍPIOS, PROMOVIDO PELO IEM  INSTITUTO DE ESTUDOS MUNICIPAIS, NOS TERMOS DA TABELA ABAIXO, CONFORME CONDIĮÕES E EXIGĘNCIAS ESTABELECIDAS NESTE INSTRUMENTO;Homologada;230;2025;;;IL230/2025;730.00;730.00
MUNICIPIO DE NAVEGANTES;Concorręncia Eletrônica - Lei 14.133/2021;229;2025;Normal - (Nova Lei de Licitaįões);CONTRATAĮÃO DE EMPRESA ESPECIALIZADA EM PRESTAĮÃO DE SERVIĮOS COM FORNECIMENTO DE MATERIAIS E MÃO DE OBRA PARA CONSTRUĮÃO DA PRAĮA DA BÍBLIA, SITUADO NA RUA VER. NEREU LIBERATO NUNES, 1298, BAIRRO CENTRO, CONFORME PROJETOS, MEMORIAL DESCRITIVO, PLANILHA ORĮAMENTÁRIA E CRONOGRAMA FÍSICO-FINANCEIRO, ATRAVÉS DA SECRETARIA DE INFRAESTRUTURA.;Aberta;229;2025;03/12/2025 09:00;7F27F334E44EF7DF7E8BDE72428611B3F60DD04D;CE229/2025;340171.12;
MUNICIPIO DE NAVEGANTES;Concorręncia Eletrônica - Lei 14.133/2021;228;2025;Normal - (Nova Lei de Licitaįões);CONCORRĘNCIA ELETRÔNICA PARA CONTRATAĮÃO DE EMPRESA ESPECIALIZADA EM PRESTAĮÃO DE SERVIĮOS PARA A EXECUĮÃO DE OBRA DE IMPLANTAĮÃO DE REDE DE MACRODRENAGEM PLUVIAL, INCLUINDO FORNECIMENTO DE MATERIAIS, EQUIPAMENTOS, MÃO DE OBRA DAS RUAS JOSÉ LINO ROCHA, MILTON SEARA MULLER, ADOLFO CABRAL JUNIOR, GERALDO JOSÉ BORBA E GERVÁSIO DE SOUZA, NO BAIRRO MEIA PRAIA, ATRAVÉS DA SECRETARIA MUNICIPAL DE INFRAESTRUTURA/SC.;Homologada;228;2025;25/11/2025 09:00;AF825F7BECFA9CCC6BBB1A6EC02EEFC928AC2149;228/2025 - CNC;9427043.56;6200499.67
MUNICIPIO DE NAVEGANTES;Inexigibilidade - Lei 14.133/2021;227;2025;Credenciamento - (Nova Lei de Licitaįões);CREDENCIAMENTO DE PESSOAS JURÍDICAS PARA A OCUPAĮÃO DE ESPAĮOS NA PRAĮA DE ALIMENTAĮÃO, INCLUINDO A COMERCIALIZAĮÃO DE ALIMENTOS E BEBIDAS, DURANTE AS FESTIVIDADES DO CALENDÁRIO DE EVENTOS DA PREFEITURA MUNICIPAL DE NAVEGANTES;Homologada;227;2025;;58773605519BE1205618F3F8460146106F2C8CAF;IL227/2025;0.18;0.22
MUNICIPIO DE NAVEGANTES;Pregão Eletrônico - Lei 14.133/2021;224;2025;Registro de Preįo - (Nova Lei de Licitaįões);PREGÃO ELETRÔNICO PARA REGISTRO DE PREĮO VISANDO A AQUISIĮÃO DE EQUIPAMENTOS E INSUMOS INERENTES PARA USO EM ANÁLISE DE QUALIDADE DÁGUA DISTRIBUÍDA VISANDO ATENDER ĀS NECESSIDADES DA SECRETARIA DE ÁGUA E SANEAMENTO BÁSICO (SASAN) DO MUNICÍPIO;Homologada;224;2025;01/12/2025 09:00;3BD5F105F71F929748937A25E76E2169B81A3AE2;PE224/2025;88962.62;25180.00
MUNICIPIO DE NAVEGANTES;Pregão Eletrônico - Lei 14.133/2021;223;2025;Registro de Preįo - (Nova Lei de Licitaįões);PREGÃO ELETRONICO PARA REGISTRO DE PREĮOS VISANDO A AQUISIĮÃO DE MATERIAIS PARA DRENAGEM (GRELHAS DE FERRO FUNDIDO E ADUELAS), PARA USO NAS MANUTENĮÕES DAS VIAS PÚBLICAS E REPAROS DA REDE PLUVIAL DO MUNICÍPIO, ATRAVÉS DA SECRETARIA MUNICIPAL DE INFRAESTRUTURA DE NAVEGANTES/SC.;Homologada;223;2025;18/11/2025 09:00;88E6435C26C61A4E6CCF8BF0FA4149EFA11F20F5;PE223/2025;1926562.50;1905000.00
MUNICIPIO DE NAVEGANTES;Inexigibilidade - Lei 14.133/2021;222;2025;Normal - (Nova Lei de Licitaįões);INEXIGIBILIDADE DE INSCRIĮÕES EM CURSOS RELATIVOS A EMENDAS PARLAMENTARES, A ELABORAĮÃO E ANÁLISE DE PROJETOS E A REFORMA TRIBUTÁRIA, PROMOVIDOS PELA ORZIL, NOS TERMOS DA TABELA ABAIXO, CONFORME CONDIĮÕES E EXIGĘNCIAS ESTABELECIDAS NESTE INSTRUMENTO.;Homologada;222;2025;;;IL222/2025;13388.00;13388.00
MUNICIPIO DE NAVEGANTES;Pregão Eletrônico - Lei 14.133/2021;220;2025;Registro de Preįo - (Nova Lei de Licitaįões);PREGÃO ELETRÔNICO PARA REGISTRO DE PREĮO VISANDO A AQUISIĮÃO DE REFLETORES LED DE ALTA POTĘNCIA PARA UTILIZAĮÃO NOS NOVOS POSTES COM SUPORTE EM MODELO DE VELA DA PRAIA DO GRAVATÁ, ATRAVÉS DA SECRETARIA MUNICIPAL DE INFRAESTRUTURA DE NAVEGANTES/SC;Homologada;220;2025;19/11/2025 09:00;63B22F7DCC7B87DB474A05867AFFEB0344D232D9;PE220/2025;973969.20;611280.00
MUNICIPIO DE NAVEGANTES;Dispensa Presencial - Lei 14.133/2021;219;2025;Normal - (Nova Lei de Licitaįões);DISPENSA DE LICITAĮÃO VISANDO A CONTRATAĮÃO DE EMPRESA ESPECIALIZADA EM PRESTAĮÃO DE SERVIĮOS PARA REALIZAĮÃO DE ENSAIOS EM 02 TRANSFORMADORES A ÓLEO 150KVA 13,8KV E 01 TRANSFORMADOR A ÓLEO 225KVA 13,8KV, ATRAVÉS DA SECRETARIA DE INFRAESTRUTURA DE NAVEGANTES/SC.;Homologada;219;2025;;B7D0C892FC98CB9221787E2B3CD42449115B233A;DL219/2025;4800.00;4800.00
MUNICIPIO DE NAVEGANTES;Inexigibilidade - Lei 14.133/2021;218;2025;Normal - (Nova Lei de Licitaįões);INSCRIĮÃO NA MISSÃO INTERNACIONAL- CHINA 2025 REALIZADO PELA FUNDAĮÃO DE ESTUDOS E PESQUISAS SOCIOECONÔMICOS (FEPESE);Homologada;218;2025;;;IL218/2025;35450.00;35450.00
MUNICIPIO DE NAVEGANTES;Dispensa Presencial - Lei 14.133/2021;217;2025;Normal - (Nova Lei de Licitaįões);DISPENSA DE LICITAĮÃO VISANDO A AQUISIĮÃO DE 80 CAMISETAS PERSONALIZADAS (CAMISETAS ALGODÃO PREMIUM FIO 30.1 PENTEADO, COM A LOGOMARCA DO PROGRAMA CIDADANIA EM CONTA) E 80 COPOS PERSONALIZADOS (PLÁSTICO RESISTENTE, CAPACIDADE DE 500 ML, PERSONALIZAĮÃO POR SUBLIMAĮÃO OU TAMPOGRAFIA).;Homologada;217;2025;;;DL217/2025;4084.00;4084.00
MUNICIPIO DE NAVEGANTES;Pregão Eletrônico - Lei 14.133/2021;216;2025;Normal - (Nova Lei de Licitaįões);PREGÃO ELETRÔNICO PARA CONTRATAĮÃO DE EMPRESA ESPECIALIZADA EM PRESTAĮÃO DE SERVIĮOS DE MANUTENĮÃO DE REDE DE ÁGUA TRATADA, COM RECOMPOSIĮÃO DE PAVIMENTO E GEOFONAMENTO PARA LOCALIZAĮÃO DE VAZAMENTO OCULTO, BEM COMO LIGAĮÃO E MANUTENĮÃO HIDROSSANITARIA ATRAVÉS DA SECRETARIA MUNICIPAL DE ÁGUA E SANEAMENTO BÁSICO DE NAVEGANTES/SC;Homologada;216;2025;28/11/2025 09:00;5A602DD626C6D32F336654FA3F0399845F7267B4;PE216/2025;4842778.00;3860000.00
MUNICIPIO DE NAVEGANTES;Pregão Eletrônico - Lei 14.133/2021;215;2025;Registro de Preįo - (Nova Lei de Licitaįões);PREGÃO ELETRÔNICO PARA REGISTRO DE PREĮO VISANDO A CONTRATAĮÃO DE EMPRESA ESPECIALIZADA EM RECUPERAĮÃO E/OU REPAROS EM REDE PLUVIAL, PARA FAZER A MANUTENĮÃO DAS RUAS CONTEMPLANDO LIMPEZA E REPAROS DE BOCA E LOBO, REPAROS EM FUGAS E A REPAVIMENTAĮÃO OCASIONADO PELOS PROBLEMAS RELATIVOS A ESSE OBJETO EM TODO MUNICÍPIO, ATRAVÉS DA SECRETARIA INFRAESTRUTURA DE NAVEGANTES/SC.;Homologada;215;2025;13/11/2025 00:00;9C7E40632C4616C06198041F6CDCC7C6823C3328;PE215/2025;3539418.80;2406804.78
MUNICIPIO DE NAVEGANTES;Pregão Eletrônico - Lei 14.133/2021;214;2025;Normal - (Nova Lei de Licitaįões);PREGÃO ELETRÔNICO PARA LOCAĮÃO DE 02 (DOIS) IMÓVEIS, LOCALIZADOS NO BAIRRO CENTRO E NO BAIRRO SÃO DOMINGOS, PARA ATENDIMENTO DAS NECESSIDADES DA ADMINISTRAĮÃO PÚBLICA MUNICIPAL DE NAVEGANTES/SC.;Homologada;214;2025;21/11/2025 09:00;3DC2F44E1052C46B2216EB5223A7653B83BB66AE;PE214/2025;1808046.00;846000.00
MUNICIPIO DE NAVEGANTES;Pregão Eletrônico - Lei 14.133/2021;211;2025;Registro de Preįo - (Nova Lei de Licitaįões);PREGÃO ELETRÔNICO PARA REGISTRO DE PREĮO VISANDO A AQUISIĮÃO DE EQUIPAMENTOS DE PROTEĮÃO INDIVIDUAL (EPIS), EQUIPAMENTOS DE PROTEĮÃO COLETIVA (EPCS) E UNIFORMES A SEREM UTILIZADOS PELOS SERVIDORES, ATRAVÉS DA SECRETARIA DE INFRAESTRUTURA DO MUNICÍPIO DE NAVEGANTES/SC.;Homologada;211;2025;17/11/2025 09:00;AC85DADD590FD12EC64A9F887BED6E22A125D68A;211/2025;518424.73;311746.11
MUNICIPIO DE NAVEGANTES;Inexigibilidade - Lei 14.133/2021;210;2025;Normal - (Nova Lei de Licitaįões);CONTRATAĮÃO DE SHOW ARTÍSTICO MUSICAL COM O CANTOR EVI GOMES E BANDA A SER REALIZADO NO DIA 31/12/2025, COM INÍCIO PREVISTO PARA AS 19H30MIN, NO BAIRRO GRAVATÁ, NA PRAĮA MARILIA SOARES, COM DURAĮÃO MÍNIMA DE 02HORAS30MINUTOS, DE ACORDO COM O CALENDÁRIO DE FESTIVIDADES DO EVENTO RÉVEILLON 2025/2026, POR MEIO DA SECRETARIA MUNICIPAL DE TURISMO.;Homologada;210;2025;;;IL210/2025;7000.00;7000.00
MUNICIPIO DE NAVEGANTES;Concorręncia Eletrônica - Lei 14.133/2021;209;2025;Normal - (Nova Lei de Licitaįões);CONCORRĘNCIA ELETRÔNICA VISANDO A CONTRATAĮÃO DE EMPRESA ESPECIALIZADA EM PRESTAĮÃO DE SERVIĮOS COM FORNECIMENTO DE MATERIAIS E MÃO DE OBRA DE PAVIMENTAĮÃO ASFÁLTICA E SINALIZAĮÃO VIÁRIA DAS RUAS EFEUZINA GAYA, CARLOS DE GÓES REBELLO, WALDEMAR BORNHAUSEN, PERCILIANA RODRIGUES GAYA, ÁUREA VITALINA VIEIRA, MANOEL IZIDRO, DONA MARIA LÍDIA BENTO E ANTÔNIO MANOEL ONÓRIO, ATRAVÉS DA SECRETARIA MUNICIPAL DE INFRAESTRUTURA/SC.;Homologada;209;2025;06/11/2025 09:00;2EED0F1AA1D3065BB041931D4E4588AE1B45A3D6;;8760560.63;5518000.00
