contaCodigo,contaDescricao,valorArrecadado
4111250010000000000,Imposto sobre a propriedade predial e territorial urbana - Principal,32731387.01
4111250020000000000,Imposto sobre a propriedade predial e territorial urbana - Multas e Juros,945446.21
4111250030000000000,Imposto sobre a propriedade predial e territorial urbana - Dívida Ativa,4203228.81
4111250040000000000,Imposto sobre a propriedade predial e territorial urbana - Dívida Ativa - Multas e Juros,2976092.75
4111253010000000000,"impostos sobre transmissão ""inter vivos"" de bens imóveis e de direitos reais sobre imóveis - Principal",25383664.44
4111253020000000000,"impostos sobre transmissão ""inter vivos"" de bens imóveis e de direitos reais sobre imóveis - Multas e Juros",134595.80
4111253030000000000,"impostos sobre transmissão ""inter vivos"" de bens imóveis e de direitos reais sobre imóveis - Dívida Ativa",245377.53
4111253040000000000,"impostos sobre transmissão ""inter vivos"" de bens imóveis e de direitos reais sobre imóveis - Dívida Ativa - Multas e Juros",2713.94
4111303110000000000,Imposto sobre a renda - retido na fonte - trabalho - Principal,26068859.74
4111303410000000000,Imposto sobre a renda - retido na fonte - outros rendimentos - Principal,10224956.79
4111451110000000000,Imposto sobre serviços de qualquer natureza - issqn - Principal,92750350.92
4111451120000000000,Imposto sobre serviços de qualquer natureza - issqn - Multas e Juros,622543.41
4111451130000000000,Imposto sobre serviços de qualquer natureza - issqn - Dívida Ativa,895558.51
4111451140000000000,Imposto sobre serviços de qualquer natureza - issqn - Dívida Ativa - Multas e Juros,415712.32
4112101010100000000,"Taxa de Licença para Func. Estab.Com., Indústrias e Prestadoras de Serviços",3216730.00
4112101010200000000,Taxa de Licença para Execução de Obras,941257.43
4112101010400000000,"Taxas de Fiscalização de Temporada, Eventual e Ambulante",19400.54
4112101020000000000,"Taxas de inspeção, controle e fiscalização - Multas e Juros",14555.41
4112101030000000000,"Taxas de inspeção, controle e fiscalização - Dívida Ativa",29002.27
4112101040000000000,"Taxas de inspeção, controle e fiscalização - Dívida Ativa - Multas e Juros",18169.48
4112104010000000000,Taxa de controle e fiscalização ambiental - Principal,161310.06
4112104020000000000,Taxa de controle e fiscalização ambiental - Multas e Juros,86.79
4112104030000000000,Taxa de controle e fiscalização ambiental - Dívida Ativa,7264.08
4112104040000000000,Taxa de controle e fiscalização ambiental - Dívida Ativa - Multas e Juros,3962.73
4112150010100000000,Taxa de fiscalização de vigilância sanitária - Principal,30246.69
4112150020000000000,Taxa de fiscalização de vigilância sanitária - Multas e Juros,934.77
4112150030000000000,Taxa de fiscalização de vigilância sanitária - Dívida Ativa,359.84
4112150040000000000,Taxa de fiscalização de vigilância sanitária - Dívida Ativa - Multas e Juros,439.73
4112201010100000000,Taxas pela Prestação de Serviços - Expediente,938173.78
4112201010400000000,Taxa pela Prestação de Serviços de Resíduos Sólidos,13540598.32
4112201019900000000,Outras Taxas pela Prestação de Serviços,438569.19
4112201020000000000,Taxas pela prestação de serviços em geral - Multas e Juros,5596.58
4112201030000000000,Taxas pela prestação de serviços em geral - Dívida Ativa,12780.88
4112201040000000000,Taxas pela prestação de serviços em geral - Dívida Ativa - Multas e Juros,14419.89
4112253010000000000,Taxa pela prestação de serviços de limpeza pública e manejo de resíduos sólidos - Principal,908019.96
4112253020000000000,Taxa pela prestação de serviços de limpeza pública e manejo de resíduos sólidos - multa e juros,25979.73
4112253030000000000,Taxa pela prestação de serviços de limpeza pública e manejo de resíduos sólidos - Dívida Ativa,29311.92
4112253040000000000,Taxa pela prestação de serviços de limpeza pública e manejo de resíduos sólidos - Multa e juros de mora da Divida ativa,17731.85
4121501110000000000,Contribuição do servidor civil ativo - Principal,24776808.73
4121501210000000000,Contribuição do servidor civil inativo - Principal,964788.62
4121501310000000000,Contribuição do servidor civil - pensionistas - Principal,37982.62
4124150010000000000,Contribuição para o custeio do serviço de iluminação pública - Principal,9598883.69
4124150020000000000,Contribuição para o custeio do serviço de iluminação pública - Multas e Juros,867.41
4124150030000000000,Contribuição para o custeio do serviço de iluminação pública - Dívida Ativa,3221.34
4124150040000000000,Contribuição para o custeio do serviço de iluminação pública - Dívida Ativa - Multas e Juros,81129.81
4131102010000000000,"Concessão, permissão, autorização ou cessão do direito de uso de bens imóveis públicos - Principal",348976.22
4131199010000000000,Outras receitas imobiliárias - Principal,50978.93
4132101010107000000,Remuneração de Aplicações de Recursos CIDE,21055.82
4132101010108000000,Remuneração de Aplicações de Recursos COSIP,629552.47
4132101010109000000,Remuneração de Aplicações de Recursos FIA Imposto de Renda,563793.24
4132101010110000000,Remuneração de Aplicações de Recursos Convênio Polícia Militar,20548.50
4132101010111000000,Remuneração de Aplicações de Recursos Convênio Polícia Civil,93072.81
4132101010112000000,Remuneração de Aplicações de Recursos Convênio Trânsito Prefeitura,165646.11
4132101010118000000,Remuneração de Aplicações de Recursos FUNDEB,1237295.76
4132101010132000000,Remuneração de Aplicações de Recursos Convênios União Educação,2124.90
4132101010133000000,Aplicação Financeira de Recursos Vinculados União Saúde,31431.29
4132101010134000000,Remuneração de Aplicações de Recursos Convênios União Outros,185666.57
4132101010135000000,Remuneração de Aplicações de Recursos do SUAS/União,232100.12
4132101010136000000,Remuneração de Aplicações de Recursos SALARIO EDUCAÇÃO,180852.69
4132101010137040000,Remuneração de Aplicações de Outras Transferências do FNDE,170524.37
4132101010138010000,Aplicação Financeira Bloco Atenção Básica,799122.52
4132101010138020000,Aplicação Financeira Bloco Atenção de Média e Alta Complexidade Ambulatorial e Hospitalar,84566.14
4132101010138030000,Aplicação Financeira Bloco Vigilância em Saúde,1396.53
4132101010138060000,Aplicação SUS Complementação Pagamentos aos Enfermeiros,22608.74
4132101010139000000,Remuneração de Aplicações de Recursos Fundo Especial do Petróleo e Transferências Decorrentes de Compensação Financeira pela Exploração de Recursos Na,489052.99
4132101010143000000,Remuneração de Aplicações de Recursos PNAE,139501.01
4132101010144000000,Remuneração de Aplicações de Recursos PNATE,2889.37
4132101010162000000,Remuneração de Aplicações de Recursos Convênios Estado Educação,60001.05
4132101010163000000,Aplicação Financeira de Recursos Vinculados Estado Saúde,25643.43
4132101010164000000,Remuneração de Aplicações de Recursos Convênios Estado Outros,398877.34
4132101010165000000,Remuneração de Aplicações de Recursos do SUAS/Estado,161763.70
4132101010167000000,Aplicação Financeira de Recursos Vinculados SUS Estado,178884.23
4132101010176000000,Remuneração de Aplicações de Recursos - Emendas Impositivas Individuais União,16182.15
4132101010179000000,Remuneração de Aplicações de Emendas Parlamentares Impositivas - Transferências do Estado,320724.24
4132101010183000000,Remuneração de Aplicações de Recursos Operações de Crédito,6054962.65
4132101010189000000,Remuneração de Aplicações de Alienação de Bens Móveis e Semoventes,31971.80
4132101010190000000,Aplicação Financeira de Recursos de Emenda Parlamentares Individuais,132471.35
4132101010203000000,903 - CAIXA ALIANÇA TP FI RF CURTO PRAZO (Administração),18838.54
4132101010204000000,Remuneração de Aplicações de Recursos SESAN,2169254.04
4132101010206000000,Remuneração de Aplicações de Recursos Diretamente Arrecadados pela Administração Indireta e Fundos,276403.80
4132101010299000000,Remuneração de Aplicações de Recursos não Vinculados,11359865.34
4132104010101000000,RENDA FIXA - RESIDUAL BETHA,465736.31
4132104010103000000,105 - CAIXA BRASIL IMA-B 5 TP FI R,805449.18
4132104010107000000,110 - SAFRA IMA INSTITUCIONAL FIC R,124060.22
4132104010109000000,114 - SANTANDER ATIVO FIC RF,788675.98
4132104010110000000,123 - BANRISUL AUTOMÁTICO FI RENDA FIXA CURTO PRAZO,461837.24
4132104010114000000, 115 - BB TP VÉRTICE 2027 FI RF PREVIDENCIÁRIO,414184.18
4132104010115000000,116 - BB TP XXI RF PREVIDENCIÁRIO,1065357.25
4132104010116000000,117 - CAIXA BRASIL 2024 IV TP FI RF,97347.98
4132104010117000000,118 - BB TP VÉRTICE 2030 FI RF PREVIDENCIÁRIO,295992.73
4132104010118000000,119 - CAIXA BRASIL 2030 II TÍTULOS PÚBLICOS FI RENDA FIXA,318287.55
4132104010119000000,"120 - BB TÍTULOS PÚBLICOS VÉRTICE 2035 FI RENDA FIXA
PREVIDENCIÁRIO",1325606.09
4132104010120000000,121 - ITAÚ ASSET NTN-B 2027 FI RENDA FIXA,883823.33
4132104010121000000,128 - BB TÍTULOS PÚBLICOS VÉRTICE 2027 II,107269.75
4132104010122000000,129 - CAIXA BRASIL ESPECIAL 2026 FIF RF PREV,201304.42
4132104010123000000,131- SAFRA NTN-B 2026 RF,17810.78
4132104010124000000,"803 - XP NTN-B 760199 2032.08.15 - IPCA+7,836%",658071.22
4132104010125000000,"804 - XP NTN-B 760199 2045.05.15 - IPCA+7,37%  (DÉFICIT ATUARIAL)",352116.22
4132104010127000000,"001 - XP NTN-B 760199 2035.05.15 - IPCA+7,310%",639113.33
4132104010130000000,202 - BRADESCO ALOCAÇÃO DINÂMICA FIC RF,531893.57
4132104010131000000,203 - BRADESCO PREMIUM FI RF REF DI,5053048.04
4132104010132000000,204 - CAIXA ALIANÇA TP FI RF CURTO PRAZO (Previdenciário 191),1728654.66
4132104010133000000,209 - BTG PACTUAL EXPLORER INSTITUCIONAL RENDA FIXA,1026147.86
4132104010134000000,206 - ITAÚ INSTITUCIONAL GLOBAL DINÂMICO FIC RF LP,113141.32
4132104010135000000,207 - RIO BRAVO ESTRATÉGICO IMA-B FI RENDA FIXA,367671.03
4132104010136000000,801 - CAIXA ALIANÇA TP FI RF CURTO PRAZO (Déficit Atuarial),2792144.73
4132104010144000000,"313 - BANCO XP - LF - IPCA+6,30% - 14.07.2025",165099.69
4132104010201000000,RENDA VARIÁVEL - RESIDUAL BETHA,27310989.61
4132104010221000000,531 - TARPON ANTLANTICUS INST RESP LTDA FIC AÇÕES,733973.68
4132104010228000000,591 - BANRISUL IT NOW IBOV CI - BOVV11,71946.26
4132104010229000000,592- BANRISUL IT NOW SPXI CI - SPXI11,53057.97
4132104010301000000,FUNDO IMOBILIÁRIO - RESIDUAL BETHA,54145.34
4132104010601000000,701 - CAIXA INDEXA BOLSA AMERICANA FIM LP,2138359.97
4133999010000000000,Outras delegações de serviços públicos - Principal,65355.00
4136101110000000000,Cessão do direito de operacionalização de pagamentos - poderes executivo e legislativo - Principal,7857000.00
4161101010100000000,Serviços Administrativos e Comerciais Gerais PM Bombeiros,882342.27
4161101010200000000,Serviços Agropecuários,50471.69
4161101010300000000,"Serviços de Captação, Adução, Tratamento, Reserva e Distribuição de Água",42967738.67
4161101019900000000,Outros Serviços Administrativos e Comerciais Gerais,1174829.30
4161102010000000000,Inscrição em concursos e processos seletivos - Principal,74945.00
4161103010000000000,"Serviços de registro, certificação e fiscalização - Principal",1253692.75
4162102010000000000,Serviços de transporte de passageiros ou mercadorias - Principal,1534969.04
4169999010100000000,Serviços de Cemitério,43.46
4169999019900000000,Outros Serviços,17271.49
4171151110000000000,Cota-parte do fundo de participação dos municípios - cota mensal - Principal,74399220.03
4171151210000000000,Cota-parte do fundo de participação dos municípios - cotas extraordinárias - Principal,9172080.73
4171152010000000000,Cota-parte do imposto sobre a propriedade territorial rural - Principal,99590.58
4171155010000000000,"Cota-parte do imposto sobre operações de crédito, câmbio e seguro, ou relativas a títulos ou valores mobiliários - comercialização do ouro - Principal",113474.02
4171252410000000000,Cota-parte do fundo especial do petróleo - fep - Principal,1320325.33
4171350110600000000,Recurso Centro de Atendimento Psicossocial - CAPS,359780.00
4171350110900000000,FAEC - Redução das filas de cirurgias (ELETIVAS),120067.34
4171350111800000000,Transferências de Recursos SUS - Atenção Primária - Agentes Comunitárias de Saúde,2841696.00
4171350112100000000,Incentivo Financeiro da APS - Atenção à Saúde Bucal,1331603.78
4171350112200000000,Implementação de Políticas para a Rede Alyne,102897.15
4171350112300000000,Incentivo Financeiro da APS - Equipes de Saúde da Família/ESF e Equipes de Atenção Primária/EAP,7320031.23
4171350112400000000,Incentivo Financeiro Para Atenção à Saúde Bucal,22806.94
4171350112500000000,Incentivo Financeiro da ASP - Componente Per Capita de Base Populacional,557033.04
4171350112600000000,Atenção Básica Emenda de Bancada Federal,1028420.00
4171350112700000000,Atenção Básica Emenda de Comissão Federal,100000.00
4171350112800000000,Recursos SUS Emendas Parlamentares Individual - Federal SAÚDE,272600.00
4171350112900000000,Recursos SUS Emendas Parlamentares de Bancada - Federal SAÚDE,200000.00
4171350210200000000,Serviço de Atendimento Móvel de Urgência - SAMU - Federal,341936.40
4171350210300000000,Recurso da Média e Alta Complexidade Ambulatorial - MAC - Federal,4011557.65
4171350210500000000,Leitos de Enfermaria Clinica de Retaguarda - MAC - Federal,258541.70
4171350310100000000,Incentivo Financeiro aos Municípios para a Vigilância Em Saúde - Despesas Diversas,281207.84
4171350310200000000,Incentivo Financeiro as Ações de Vigilância e Prevenção e Controle das DST/AIDS e Hepatites Virais,188992.40
4171350310500000000,Transferências aos Entes Federativos Para o Pagamento dos Vencimentos dos Agentes de Combate as Endemias,670956.00
4171350410300000000,Recursos Financ. a Transferir as Secretarias de Saúde Mun. Est. e do DF Para a Qualif. da Assist. Farmacêutica - Qualifar - SUS,18000.00
4171350410400000000,"Recursos Financeiros a Transferir Para Aquisição Pelas Secretarias de Saúde Dos Estados, Municípios e do Distrito Federal",717128.40
4171350510200000000,"Assistência Financeira Complementar aos Estados, DF e Municípios P/ o Pag. do Piso Salarial dos Profissionais da Enfermagem",1191713.65
4171350510300000000,Implementação da Segurança Alimentar e Nutricional na Saúde,32571.08
4171450010000000000,Transferências do salário-educação - Principal,11109597.36
4171452010000000000,Transferências referentes ao programa nacional de alimentação escolar - pnae - Principal,3045576.10
4171453010000000000,Transferências referentes ao programa nacional de apoio ao transporte do escolar - pnate - Principal,58597.31
4171552010000000000,Transferências de recursos de complementação da união ao FUNDEB - vaar - Principal,402424.80
4171553010000000000,Transferências de recursos do FUNDEB destinados à criação de matrículas em Eti- Principal,12665.30
4171650010103000000,Índice de Gestão Descentralizada - IGDBF,113786.48
4171650010151000000,Piso Fixo de Média Complexidade - PAEFI,72900.52
4171650010152000000,Piso Fixo de Média Complexidade - MSE,40095.29
4171650010153000000,Piso Fixo de Média Complexidade - ABORDAGEM SOCIAL,58926.47
4171650010154000000,Piso de Transição de Média Complexidade,8312.05
4171650010155000000,Programa do Piso de Alta Complexidade I - Criança/ Adolescente,45562.82
4171650010156000000,Serviço de Convivência e Fortalecimento de Vínculos,95053.86
4171650010157000000,Piso Básico Fixo,109771.46
4171957010200000000,Emendas Parlamentares Individuais da União - Incremento Temporário Atenção Primária a Saúde,500000.00
4171957010300000000,Emendas Parlamentares Individuais da União - Incremento Temporário ao custeio dos serviços de assistência hospitalar e ambulatorial,600000.00
4171999010000000000,Outras transferências de recursos da união e de suas entidades - Principal,274439.88
4172150010000000000,Cota-parte do ICMS - Principal,149877235.12
4172151010000000000,Cota-parte do IPVA - Principal,18106067.39
4172152010000000000,Cota-parte do IPI - municípios - Principal,1667994.76
4172153010000000000,Cota-parte da contribuição de intervenção no domínio econômico - Principal,86203.94
4172350010100000000,Recursos Piso de Atenção Básica - PAB - Estadual,35000.00
4172350010500000000,Recurso Farmácia Básica - Estadual,366637.44
4172350010600000000,Recurso Centro de Especialidades Odontológicas - CEO - Estadual,59800.00
4172350011100000000,Recurso ESF - Estratégia Saúde da Família e SB - Saúde Bucal - Estadual,1277800.00
4172350011200000000,Recurso Programa de Valorização dos Hospitais,1560000.00
4172350011300000000,Recurso Cirurgia Eletiva - Estadual,675227.23
4172451010000000000,Transferências de convênios dos estados destinadas a programas de educação - Principal,528365.02
4172499010000000000,Outras transferências de convênios dos estados e df e de suas entidades - Principal,700000.00
4172951010100000000,Transferências SUAS Estado - Beneficios Eventuais,155815.30
4172951010600000000,Transferências SUAS Estado - PROTEÇÃO SOCIAL BÁSICA,147570.11
4172951010900000000,Transferências SUAS Estado - INCETIVO GESTÃO MUNICIPAL,5992.90
4172951011000000000,Transferências SUAS Estado - PROTEÇÃO SOCIAL ESPECIAL,226710.57
4172999010100000000,Emendas Parlamentares Impositivas - Transferências Correntes do Estado,824091.22
4174199010000000000,Outras transferências de instituições privadas - Principal,1935807.38
4175150010000000000,Transferências de recursos do fundo de manutenção e desenvolvimento da educação básica e de valorização dos profissionais da educação - FUNDEB - Principal,170369231.17
4179199010000000000,Outras transferências de pessoas físicas - Principal,2043.27
4191101011000000000,Multas Previstas na Legislação de Trânsito Convênio Trânsito - Militar,587820.57
4191101011100000000,Multas Previstas na Legislação de Trânsito Convênio Trânsito - Civil,587820.56
4191101011200000000,Multas Previstas na Legislação de Trânsito Convênio Trânsito - Prefeitura,1917877.50
4191101019900000000,Outras Multas Previstas em Legislação Específica - Principal,175398.46
4191101020000000000,Multas previstas em legislação específica - Multas e Juros,2476.31
4191101030000000000,Multas previstas em legislação específica - Dívida Ativa,1076.77
4191101040000000000,Multas previstas em legislação específica - Dívida Ativa - Multas e Juros,1316.53
4191104010000000000,Multas previstas na legislação sobre defesa dos direitos difusos - Principal,15334.66
4191104030000000000,Multas previstas na legislação sobre defesa dos direitos difusos - Dívida Ativa,389.75
4191104040000000000,Multas previstas na legislação sobre defesa dos direitos difusos - Dívida Ativa - Multas e Juros,288.81
4191106110000000000,Multas administrativas por danos ambientais - Principal,3763.92
4191107030000000000,Multas Aplicadas Pelos Tribunais de Contas - Dívida Ativa,1182.70
4191107040000000000,Multas Aplicadas Pelos Tribunais de Contas - Multa e Juros de Mora da Divida Ativa,424.67
4191109010000000000,Multas e juros previstos em contratos - Principal,24039.21
4192206110000000000,Restituição de Despesas de Exercícios Anteriores - Principal,20354.08
4192206310000000000,Restituição de despesas primárias de exercícios anteriores - Principal,1431.04
4192206410000000000,Restituição de despesas financeiras de exercícios anteriores - Principal,170531.14
4192299010000000000,Outras restituições - Principal,25946.48
4199903010000000000,Compensações financeiras entre os regimes de previdência - Principal,9652739.60
4199912210000000000,Ônus de Sucumbência - Principal,1055978.14
4199999110000000000,Outras receitas administradas pela rfb - Principal,689627.09
4199999120000000000,Outras receitas administradas pela rfb - Multas e Juros de Mora,217396.44
4199999130000000000,Outras receitas administradas pela rfb - Dívida Ativa,673899.13
4199999140000000000,Outras receitas administradas pela rfb - Multas e Juros de Mora da Divida Ativa,1760967.64
4211201010000000000,Operações de crédito contratuais - mercado interno - Principal,38742237.38
4221301010000000000,Alienação de bens móveis e semoventes - Principal,340000.00
4241450010000000000,Transferências de convênios da união para o sistema único de saúde - SUS - Principal,2783622.00
4241451010000000000,Transferências de convênios da união destinadas a programas de educação - Principal,464804.01
4241951010000000000,Transferência especial da união - Principal,495000.00
4242299010000000000,Outras transferências de convênios dos estados e df e de suas entidades - Principal,3533217.71
4242999010100000000,Emendas Parlamentares Impositivas - Transferências de Capital do Estado,450000.00
4242999011299000000,Outras Transferências SUAS Estado Investimento,77201.68
4721502110000000000,Contribuição patronal - servidor civil ativo - Principal,32558860.56
4721550110000000000,Contribuição patronal - servidor civil - inativo - Principal,5379924.46
4721550210000000000,Contribuição patronal - servidor civil - pensionistas - Principal,848549.99
4761101010300000000,"Receitas Intra-Orçamentárias/Serviços de Captação,Adução,Tratamento...",277788.82
4799901010000000000,Aportes periódicos para amortização de déficit atuarial do regimes próprios de previdência e sistema de proteção social - Principal,4223467.56
9111250010000000000,Imposto sobre a propriedade predial e territorial urbana - Principal,-30254.37
9111250010000000001,Imposto sobre a Propriedade Predial e Territorial Urbana - Principal - Renúncia,-17.78
9111250010000000002,Imposto sobre a Propriedade Predial e Territorial Urbana - Principal,-7793.68
9111250010000000003,Imposto sobre a Propriedade Predial e Territorial Urbana - Principal - Descontos Concedidos,-3126938.71
9111250020000000001,Multas e Juros de Mora - Imposto sobre a Propriedade Predial e Territorial Urbana - Renúncia,-756.79
9111250020000000003,Multas e Juros de Mora - Imposto sobre a Propriedade Predial e Territorial Urbana - Descontos Concedidos,-494.11
9111250030000000001,Dívida Ativa - Imposto sobre a Propriedade Predial e Territorial Urbana - Renúncia,-31.47
9111250040000000001,Dívida Ativa - Multas e Juros de Mora da Dívida Ativa - Imposto sobre a Propriedade Predial e Territorial Urbana - Renúncia,-135.00
9111250040000000003,Dívida Ativa - Multas e Juros de Mora da Dívida Ativa - Imposto sobre a Propriedade Predial e Territorial Urbana - Descontos Concedidos,-841671.47
9111253010000000002,Imposto sobre Transmissão de Bens Imóveis e de Direitos Reais sobre Imóveis - Principal,-180750.00
9111253010000000003,Imposto sobre Transmissão de Bens Imóveis e de Direitos Reais sobre Imóveis - Principal - Descontos Concedidos,-513.45
9111253020000000003,Multas e Juros de Mora -  Imposto sobre Transmissão de Bens Imóveis e de Direitos Reais sobre Imóveis - Descontos Concedidos,-236.04
9111253030000000002,(D) Dívida Ativa - Imposto sobre Transmissão de Bens Imóveis e de Direitos Reais sobre Imóveis,-204833.77
9111253040000000003,Dívida Ativa - Multas e Juros de Mora da Dívida Ativa - Imposto sobre Transmissão de Bens Imóveis e de Direitos Reais sobre Imóveis - Descontos Concedidos,-1341.11
9111303410000000000,Imposto sobre a renda - retido na fonte - outros rendimentos - Principal,-220.75
9111451110000000001,Imposto sobre Serviços de Qualquer Natureza - ISSQN - Principal - Renúncia,-0.43
9111451110000000002,Imposto sobre Serviços de Qualquer Natureza - ISSQN - Principal,-17287.39
9111451120000000001,Multas e Juros de Mora - Imposto sobre Serviços de Qualquer Natureza - ISSQN - Renúncia,-62.63
9111451130000000001,Dívida Ativa - Imposto sobre Serviços de Qualquer Natureza - ISSQN - Renúncia,-2.14
9111451140000000001,Dívida Ativa - Multas e Juros de Mora da Dívida Ativa - Imposto sobre Serviços de Qualquer Natureza - ISSQN - Renúncia,-24.30
9111451140000000003,Dívida Ativa - Multas e Juros de Mora da Dívida Ativa - Imposto sobre Serviços de Qualquer Natureza - ISSQN - Descontos Concedidos,-49156.33
9112101010100000001,"Taxa de Licença para Func. Estab.Com., Indústrias e Prestadoras de Serviços - Renúncia",-0.61
9112101010100000002,"Taxa de Licença para Func. Estab.Com., Indústrias e Prestadoras de Serviços",-3368.30
9112101010200000001,Taxa de Licença para Execução de Obras - Renúncia,-0.01
9112101030000000001,"Dívida Ativa - Taxas de Inspeção, Controle e Fiscalização - Renúncia",-0.02
9112201010100000002,Taxas pela Prestação de Serviços - Expediente,-1770.39
9112201010100000003,Taxas pela Prestação de Serviços - Expediente - Descontos Concedidos,-8.49
9112201010400000000,Taxa pela Prestação de Serviços de Resíduos Sólidos,-3495.27
9112201010400000001,Taxa pela Prestação de Serviços de Resíduos Sólidos - Renúncia,-1.00
9112201019900000001,Outras Taxas pela Prestação de Serviços - Renúncia,-96.94
9112201019900000003,Outras Taxas pela Prestação de Serviços - Descontos Concedidos,-154.74
9124150010000000001,Contribuição para o Custeio do Serviço de Iluminação Pública - Principal - Renúncia,-0.03
9131102010000000002,"(D) Concessão, Permissão, Autorização ou Cessão do Direito de Uso de Bens Imóveis Públicos",-816.28
9131199010000000002,(D) Outras Receitas Imobiliárias - Principal,-1710.24
